[
  {
    "date": "2026-05-01",
    "match": {
      "home": "ヤクルト",
      "visitor": "DeNA"
    },
    "info": {
      "stadium": "",
      "time": ""
    },
    "ticket": {
      "primary": "https://ticket.yakult-swallows.co.jp/Calendar.aspx",
      "resale": "https://tradead.tixplus.jp/swallows/buy/bidding?month=5&year=2026"
    }
  },
  {
    "date": "2026-05-01",
    "match": {
      "home": "阪神",
      "visitor": "巨人"
    },
    "info": {
      "stadium": "",
      "time": ""
    },
    "ticket": {
      "primary": "https://hanshintigers.jp/ticket/detail/20260501.html"
    }
  },
  {
    "date": "2026-05-01",
    "match": {
      "home": "広島",
      "visitor": "中日"
    },
    "info": {
      "stadium": "",
      "time": ""
    },
    "ticket": {
      "primary": "https://www.carp.co.jp/ticket/ticket/yoyaku_hoho.html"
    }
  },
  {
    "date": "2026-05-01",
    "match": {
      "home": "日本ハム",
      "visitor": "オリックス"
    },
    "info": {
      "stadium": "",
      "time": ""
    },
    "ticket": {
      "primary": "https://ticket.fighters.co.jp/event/list/self/1",
      "resale": "https://ticket.fighters.co.jp/event/list/resale/1"
    }
  },
  {
    "date": "2026-05-01",
    "match": {
      "home": "ロッテ",
      "visitor": "西武"
    },
    "info": {
      "stadium": "",
      "time": ""
    },
    "ticket": {
      "primary": "https://m-ticket.marines.co.jp/ticket/20260501",
      "resale": "https://www.ticket.co.jp/sys/k/79881.htm?st=20260501"
    }
  },
  {
    "date": "2026-05-01",
    "match": {
      "home": "ソフトバンク",
      "visitor": "楽天"
    },
    "info": {
      "stadium": "",
      "time": ""
    },
    "ticket": {
      "primary": "https://ticket.softbankhawks.co.jp/game/select"
    }
  },
  {
    "date": "2026-05-02",
    "match": {
      "home": "ヤクルト",
      "visitor": "DeNA"
    },
    "info": {
      "stadium": "",
      "time": ""
    },
    "ticket": {
      "primary": "https://ticket.yakult-swallows.co.jp/Calendar.aspx",
      "resale": "https://tradead.tixplus.jp/swallows/buy/bidding?month=5&year=2026"
    }
  },
  {
    "date": "2026-05-02",
    "match": {
      "home": "阪神",
      "visitor": "巨人"
    },
    "info": {
      "stadium": "",
      "time": ""
    },
    "ticket": {
      "primary": "https://hanshintigers.jp/ticket/detail/20260502.html"
    }
  },
  {
    "date": "2026-05-02",
    "match": {
      "home": "広島",
      "visitor": "中日"
    },
    "info": {
      "stadium": "",
      "time": ""
    },
    "ticket": {
      "primary": "https://www.carp.co.jp/ticket/ticket/yoyaku_hoho.html"
    }
  },
  {
    "date": "2026-05-02",
    "match": {
      "home": "日本ハム",
      "visitor": "オリックス"
    },
    "info": {
      "stadium": "",
      "time": ""
    },
    "ticket": {
      "primary": "https://ticket.fighters.co.jp/event/list/self/1",
      "resale": "https://ticket.fighters.co.jp/event/list/resale/1"
    }
  },
  {
    "date": "2026-05-02",
    "match": {
      "home": "ロッテ",
      "visitor": "西武"
    },
    "info": {
      "stadium": "",
      "time": ""
    },
    "ticket": {
      "primary": "https://m-ticket.marines.co.jp/ticket/20260502",
      "resale": "https://www.ticket.co.jp/sys/k/79881.htm?st=20260502"
    }
  },
  {
    "date": "2026-05-02",
    "match": {
      "home": "ソフトバンク",
      "visitor": "楽天"
    },
    "info": {
      "stadium": "",
      "time": ""
    },
    "ticket": {
      "primary": "https://ticket.softbankhawks.co.jp/game/select"
    }
  },
  {
    "date": "2026-05-03",
    "match": {
      "home": "ヤクルト",
      "visitor": "DeNA"
    },
    "info": {
      "stadium": "",
      "time": ""
    },
    "ticket": {
      "primary": "https://ticket.yakult-swallows.co.jp/Calendar.aspx",
      "resale": "https://tradead.tixplus.jp/swallows/buy/bidding?month=5&year=2026"
    }
  },
  {
    "date": "2026-05-03",
    "match": {
      "home": "阪神",
      "visitor": "巨人"
    },
    "info": {
      "stadium": "",
      "time": ""
    },
    "ticket": {
      "primary": "https://hanshintigers.jp/ticket/detail/20260503.html"
    }
  },
  {
    "date": "2026-05-03",
    "match": {
      "home": "広島",
      "visitor": "中日"
    },
    "info": {
      "stadium": "",
      "time": ""
    },
    "ticket": {
      "primary": "https://www.carp.co.jp/ticket/ticket/yoyaku_hoho.html"
    }
  },
  {
    "date": "2026-05-03",
    "match": {
      "home": "日本ハム",
      "visitor": "オリックス"
    },
    "info": {
      "stadium": "",
      "time": ""
    },
    "ticket": {
      "primary": "https://ticket.fighters.co.jp/event/list/self/1",
      "resale": "https://ticket.fighters.co.jp/event/list/resale/1"
    }
  },
  {
    "date": "2026-05-03",
    "match": {
      "home": "ロッテ",
      "visitor": "西武"
    },
    "info": {
      "stadium": "",
      "time": ""
    },
    "ticket": {
      "primary": "https://m-ticket.marines.co.jp/ticket/20260503",
      "resale": "https://www.ticket.co.jp/sys/k/79881.htm?st=20260503"
    }
  },
  {
    "date": "2026-05-03",
    "match": {
      "home": "ソフトバンク",
      "visitor": "楽天"
    },
    "info": {
      "stadium": "",
      "time": ""
    },
    "ticket": {
      "primary": "https://ticket.softbankhawks.co.jp/game/select"
    }
  },
  {
    "date": "2026-05-04",
    "match": {
      "home": "巨人",
      "visitor": "ヤクルト"
    },
    "info": {
      "stadium": "",
      "time": ""
    },
    "ticket": {
      "primary": "https://www.giants.jp/schedule/first-team/?month=202605",
      "resale": "https://tradead.tixplus.jp/giants/buy/bidding?month=5&year=2026"
    }
  },
  {
    "date": "2026-05-04",
    "match": {
      "home": "DeNA",
      "visitor": "広島"
    },
    "info": {
      "stadium": "",
      "time": ""
    },
    "ticket": {
      "primary": "https://ticketsales.baystars.co.jp/calendar/2026/05",
      "resale": "https://ticket-resale.baystars.co.jp/purchase/match"
    }
  },
  {
    "date": "2026-05-04",
    "match": {
      "home": "中日",
      "visitor": "阪神"
    },
    "info": {
      "stadium": "",
      "time": ""
    },
    "ticket": {
      "primary": "https://dragons-ticket.jp/Calendar.aspx",
      "resale": "https://tradead.tixplus.jp/dragons/buy/bidding?month=5&year=2026"
    }
  },
  {
    "date": "2026-05-04",
    "match": {
      "home": "楽天",
      "visitor": "日本ハム"
    },
    "info": {
      "stadium": "",
      "time": ""
    },
    "ticket": {
      "primary": "https://eagles.tstar.jp/seat260504",
      "resale": "https://nft.rakuten.co.jp/marketplace/?type=ticket&sort=last_updated_date&limit=12&ticketlimit=6&provider=eagles&date=04-05-2026"
    }
  },
  {
    "date": "2026-05-04",
    "match": {
      "home": "西武",
      "visitor": "ソフトバンク"
    },
    "info": {
      "stadium": "",
      "time": ""
    },
    "ticket": {
      "primary": "https://ticket.seibulions.jp/event/venue/26050401",
      "resale": [
        "https://ticket.seibulions.jp/resale/venue/26050401",
        "https://www.ticket.co.jp/sys/k/68848.htm?st=20260504"
      ]
    }
  },
  {
    "date": "2026-05-04",
    "match": {
      "home": "オリックス",
      "visitor": "ロッテ"
    },
    "info": {
      "stadium": "",
      "time": ""
    },
    "ticket": {
      "primary": "https://buffaloes.cnplayguide.com/ticket/20260504",
      "resale": "https://www.ticket.co.jp/sys/k/79911.htm?st=20260504"
    }
  },
  {
    "date": "2026-05-05",
    "match": {
      "home": "巨人",
      "visitor": "ヤクルト"
    },
    "info": {
      "stadium": "",
      "time": ""
    },
    "ticket": {
      "primary": "https://www.giants.jp/schedule/first-team/?month=202605",
      "resale": "https://tradead.tixplus.jp/giants/buy/bidding?month=5&year=2026"
    }
  },
  {
    "date": "2026-05-05",
    "match": {
      "home": "DeNA",
      "visitor": "広島"
    },
    "info": {
      "stadium": "",
      "time": ""
    },
    "ticket": {
      "primary": "https://ticketsales.baystars.co.jp/calendar/2026/05",
      "resale": "https://ticket-resale.baystars.co.jp/purchase/match"
    }
  },
  {
    "date": "2026-05-05",
    "match": {
      "home": "中日",
      "visitor": "阪神"
    },
    "info": {
      "stadium": "",
      "time": ""
    },
    "ticket": {
      "primary": "https://dragons-ticket.jp/Calendar.aspx",
      "resale": "https://tradead.tixplus.jp/dragons/buy/bidding?month=5&year=2026"
    }
  },
  {
    "date": "2026-05-05",
    "match": {
      "home": "楽天",
      "visitor": "日本ハム"
    },
    "info": {
      "stadium": "",
      "time": ""
    },
    "ticket": {
      "primary": "https://eagles.tstar.jp/seat260505",
      "resale": "https://nft.rakuten.co.jp/marketplace/?type=ticket&sort=last_updated_date&limit=12&ticketlimit=6&provider=eagles&date=05-05-2026"
    }
  },
  {
    "date": "2026-05-05",
    "match": {
      "home": "西武",
      "visitor": "ソフトバンク"
    },
    "info": {
      "stadium": "",
      "time": ""
    },
    "ticket": {
      "primary": "https://ticket.seibulions.jp/event/venue/26050501",
      "resale": [
        "https://ticket.seibulions.jp/resale/venue/26050501",
        "https://www.ticket.co.jp/sys/k/68848.htm?st=20260505"
      ]
    }
  },
  {
    "date": "2026-05-05",
    "match": {
      "home": "オリックス",
      "visitor": "ロッテ"
    },
    "info": {
      "stadium": "",
      "time": ""
    },
    "ticket": {
      "primary": "https://buffaloes.cnplayguide.com/ticket/20260505",
      "resale": "https://www.ticket.co.jp/sys/k/79911.htm?st=20260505"
    }
  },
  {
    "date": "2026-05-06",
    "match": {
      "home": "巨人",
      "visitor": "ヤクルト"
    },
    "info": {
      "stadium": "",
      "time": ""
    },
    "ticket": {
      "primary": "https://www.giants.jp/schedule/first-team/?month=202605",
      "resale": "https://tradead.tixplus.jp/giants/buy/bidding?month=5&year=2026"
    }
  },
  {
    "date": "2026-05-06",
    "match": {
      "home": "DeNA",
      "visitor": "広島"
    },
    "info": {
      "stadium": "",
      "time": ""
    },
    "ticket": {
      "primary": "https://ticketsales.baystars.co.jp/calendar/2026/05",
      "resale": "https://ticket-resale.baystars.co.jp/purchase/match"
    }
  },
  {
    "date": "2026-05-06",
    "match": {
      "home": "中日",
      "visitor": "阪神"
    },
    "info": {
      "stadium": "",
      "time": ""
    },
    "ticket": {
      "primary": "https://dragons-ticket.jp/Calendar.aspx",
      "resale": "https://tradead.tixplus.jp/dragons/buy/bidding?month=5&year=2026"
    }
  },
  {
    "date": "2026-05-06",
    "match": {
      "home": "楽天",
      "visitor": "日本ハム"
    },
    "info": {
      "stadium": "",
      "time": ""
    },
    "ticket": {
      "primary": "https://eagles.tstar.jp/seat260506",
      "resale": "https://nft.rakuten.co.jp/marketplace/?type=ticket&sort=last_updated_date&limit=12&ticketlimit=6&provider=eagles&date=06-05-2026"
    }
  },
  {
    "date": "2026-05-06",
    "match": {
      "home": "西武",
      "visitor": "ソフトバンク"
    },
    "info": {
      "stadium": "",
      "time": ""
    },
    "ticket": {
      "primary": "https://ticket.seibulions.jp/event/venue/26050601",
      "resale": [
        "https://ticket.seibulions.jp/resale/venue/26050601",
        "https://www.ticket.co.jp/sys/k/68848.htm?st=20260506"
      ]
    }
  },
  {
    "date": "2026-05-06",
    "match": {
      "home": "オリックス",
      "visitor": "ロッテ"
    },
    "info": {
      "stadium": "",
      "time": ""
    },
    "ticket": {
      "primary": "https://buffaloes.cnplayguide.com/ticket/20260506",
      "resale": "https://www.ticket.co.jp/sys/k/79911.htm?st=20260506"
    }
  },
  {
    "date": "2026-05-08",
    "match": {
      "home": "中日",
      "visitor": "巨人"
    },
    "info": {
      "stadium": "",
      "time": ""
    },
    "ticket": {
      "primary": "https://dragons-ticket.jp/Calendar.aspx",
      "resale": "https://tradead.tixplus.jp/dragons/buy/bidding?month=5&year=2026"
    }
  },
  {
    "date": "2026-05-08",
    "match": {
      "home": "阪神",
      "visitor": "DeNA"
    },
    "info": {
      "stadium": "",
      "time": ""
    },
    "ticket": {
      "primary": "https://hanshintigers.jp/ticket/detail/20260508.html"
    }
  },
  {
    "date": "2026-05-08",
    "match": {
      "home": "広島",
      "visitor": "ヤクルト"
    },
    "info": {
      "stadium": "",
      "time": ""
    },
    "ticket": {
      "primary": "https://www.carp.co.jp/ticket/ticket/yoyaku_hoho.html"
    }
  },
  {
    "date": "2026-05-08",
    "match": {
      "home": "西武",
      "visitor": "楽天"
    },
    "info": {
      "stadium": "",
      "time": ""
    },
    "ticket": {
      "primary": "https://ticket.seibulions.jp/event/venue/26050801",
      "resale": [
        "https://ticket.seibulions.jp/resale/venue/26050801",
        "https://www.ticket.co.jp/sys/k/68848.htm?st=20260508"
      ]
    }
  },
  {
    "date": "2026-05-08",
    "match": {
      "home": "オリックス",
      "visitor": "日本ハム"
    },
    "info": {
      "stadium": "",
      "time": ""
    },
    "ticket": {
      "primary": "https://buffaloes.cnplayguide.com/ticket/20260508",
      "resale": "https://www.ticket.co.jp/sys/k/79911.htm?st=20260508"
    }
  },
  {
    "date": "2026-05-08",
    "match": {
      "home": "ソフトバンク",
      "visitor": "ロッテ"
    },
    "info": {
      "stadium": "",
      "time": ""
    },
    "ticket": {
      "primary": "https://ticket.softbankhawks.co.jp/game/select"
    }
  },
  {
    "date": "2026-05-09",
    "match": {
      "home": "中日",
      "visitor": "巨人"
    },
    "info": {
      "stadium": "",
      "time": ""
    },
    "ticket": {
      "primary": "https://dragons-ticket.jp/Calendar.aspx",
      "resale": "https://tradead.tixplus.jp/dragons/buy/bidding?month=5&year=2026"
    }
  },
  {
    "date": "2026-05-09",
    "match": {
      "home": "阪神",
      "visitor": "DeNA"
    },
    "info": {
      "stadium": "",
      "time": ""
    },
    "ticket": {
      "primary": "https://hanshintigers.jp/ticket/detail/20260509.html"
    }
  },
  {
    "date": "2026-05-09",
    "match": {
      "home": "広島",
      "visitor": "ヤクルト"
    },
    "info": {
      "stadium": "",
      "time": ""
    },
    "ticket": {
      "primary": "https://www.carp.co.jp/ticket/ticket/yoyaku_hoho.html"
    }
  },
  {
    "date": "2026-05-09",
    "match": {
      "home": "西武",
      "visitor": "楽天"
    },
    "info": {
      "stadium": "",
      "time": ""
    },
    "ticket": {
      "primary": "https://ticket.seibulions.jp/event/venue/26050901",
      "resale": [
        "https://ticket.seibulions.jp/resale/venue/26050901",
        "https://www.ticket.co.jp/sys/k/68848.htm?st=20260509"
      ]
    }
  },
  {
    "date": "2026-05-09",
    "match": {
      "home": "オリックス",
      "visitor": "日本ハム"
    },
    "info": {
      "stadium": "",
      "time": ""
    },
    "ticket": {
      "primary": "https://buffaloes.cnplayguide.com/ticket/20260509",
      "resale": "https://www.ticket.co.jp/sys/k/79911.htm?st=20260509"
    }
  },
  {
    "date": "2026-05-09",
    "match": {
      "home": "ソフトバンク",
      "visitor": "ロッテ"
    },
    "info": {
      "stadium": "",
      "time": ""
    },
    "ticket": {
      "primary": "https://ticket.softbankhawks.co.jp/game/select"
    }
  },
  {
    "date": "2026-05-10",
    "match": {
      "home": "中日",
      "visitor": "巨人"
    },
    "info": {
      "stadium": "",
      "time": ""
    },
    "ticket": {
      "primary": "https://dragons-ticket.jp/Calendar.aspx",
      "resale": "https://tradead.tixplus.jp/dragons/buy/bidding?month=5&year=2026"
    }
  },
  {
    "date": "2026-05-10",
    "match": {
      "home": "阪神",
      "visitor": "DeNA"
    },
    "info": {
      "stadium": "",
      "time": ""
    },
    "ticket": {
      "primary": "https://hanshintigers.jp/ticket/detail/20260510.html"
    }
  },
  {
    "date": "2026-05-10",
    "match": {
      "home": "広島",
      "visitor": "ヤクルト"
    },
    "info": {
      "stadium": "",
      "time": ""
    },
    "ticket": {
      "primary": "https://www.carp.co.jp/ticket/ticket/yoyaku_hoho.html"
    }
  },
  {
    "date": "2026-05-10",
    "match": {
      "home": "西武",
      "visitor": "楽天"
    },
    "info": {
      "stadium": "",
      "time": ""
    },
    "ticket": {
      "primary": "https://ticket.seibulions.jp/event/venue/26051001",
      "resale": [
        "https://ticket.seibulions.jp/resale/venue/26051001",
        "https://www.ticket.co.jp/sys/k/68848.htm?st=20260510"
      ]
    }
  },
  {
    "date": "2026-05-10",
    "match": {
      "home": "オリックス",
      "visitor": "日本ハム"
    },
    "info": {
      "stadium": "",
      "time": ""
    },
    "ticket": {
      "primary": "https://buffaloes.cnplayguide.com/ticket/20260510",
      "resale": "https://www.ticket.co.jp/sys/k/79911.htm?st=20260510"
    }
  },
  {
    "date": "2026-05-10",
    "match": {
      "home": "ソフトバンク",
      "visitor": "ロッテ"
    },
    "info": {
      "stadium": "",
      "time": ""
    },
    "ticket": {
      "primary": "https://ticket.softbankhawks.co.jp/game/select"
    }
  },
  {
    "date": "2026-05-12",
    "match": {
      "home": "巨人",
      "visitor": "広島"
    },
    "info": {
      "stadium": "岐阜",
      "time": ""
    },
    "ticket": {
      "primary": "https://www.giants.jp/schedule/first-team/?month=202605",
      "resale": "https://tradead.tixplus.jp/giants/buy/bidding?month=5&year=2026"
    }
  },
  {
    "date": "2026-05-12",
    "match": {
      "home": "ヤクルト",
      "visitor": "阪神"
    },
    "info": {
      "stadium": "",
      "time": ""
    },
    "ticket": {
      "primary": "https://ticket.yakult-swallows.co.jp/Calendar.aspx",
      "resale": "https://tradead.tixplus.jp/swallows/buy/bidding?month=5&year=2026"
    }
  },
  {
    "date": "2026-05-12",
    "match": {
      "home": "DeNA",
      "visitor": "中日"
    },
    "info": {
      "stadium": "",
      "time": ""
    },
    "ticket": {
      "primary": "https://ticketsales.baystars.co.jp/calendar/2026/05",
      "resale": "https://ticket-resale.baystars.co.jp/purchase/match"
    }
  },
  {
    "date": "2026-05-12",
    "match": {
      "home": "楽天",
      "visitor": "オリックス"
    },
    "info": {
      "stadium": "弘前",
      "time": ""
    },
    "ticket": {
      "primary": "https://eagles.tstar.jp/seat260512",
      "resale": "https://nft.rakuten.co.jp/marketplace/?type=ticket&sort=last_updated_date&limit=12&ticketlimit=6&provider=eagles&date=12-05-2026"
    }
  },
  {
    "date": "2026-05-12",
    "match": {
      "home": "ロッテ",
      "visitor": "日本ハム"
    },
    "info": {
      "stadium": "",
      "time": ""
    },
    "ticket": {
      "primary": "https://m-ticket.marines.co.jp/ticket/20260512",
      "resale": "https://www.ticket.co.jp/sys/k/79881.htm?st=20260512"
    }
  },
  {
    "date": "2026-05-12",
    "match": {
      "home": "ソフトバンク",
      "visitor": "西武"
    },
    "info": {
      "stadium": "",
      "time": ""
    },
    "ticket": {
      "primary": "https://ticket.softbankhawks.co.jp/game/select"
    }
  },
  {
    "date": "2026-05-13",
    "match": {
      "home": "巨人",
      "visitor": "広島"
    },
    "info": {
      "stadium": "福井",
      "time": ""
    },
    "ticket": {
      "primary": "https://www.giants.jp/schedule/first-team/?month=202605",
      "resale": "https://tradead.tixplus.jp/giants/buy/bidding?month=5&year=2026"
    }
  },
  {
    "date": "2026-05-13",
    "match": {
      "home": "ヤクルト",
      "visitor": "阪神"
    },
    "info": {
      "stadium": "",
      "time": ""
    },
    "ticket": {
      "primary": "https://ticket.yakult-swallows.co.jp/Calendar.aspx",
      "resale": "https://tradead.tixplus.jp/swallows/buy/bidding?month=5&year=2026"
    }
  },
  {
    "date": "2026-05-13",
    "match": {
      "home": "DeNA",
      "visitor": "中日"
    },
    "info": {
      "stadium": "",
      "time": ""
    },
    "ticket": {
      "primary": "https://ticketsales.baystars.co.jp/calendar/2026/05",
      "resale": "https://ticket-resale.baystars.co.jp/purchase/match"
    }
  },
  {
    "date": "2026-05-13",
    "match": {
      "home": "ロッテ",
      "visitor": "日本ハム"
    },
    "info": {
      "stadium": "",
      "time": ""
    },
    "ticket": {
      "primary": "https://m-ticket.marines.co.jp/ticket/20260513",
      "resale": "https://www.ticket.co.jp/sys/k/79881.htm?st=20260513"
    }
  },
  {
    "date": "2026-05-13",
    "match": {
      "home": "ソフトバンク",
      "visitor": "西武"
    },
    "info": {
      "stadium": "",
      "time": ""
    },
    "ticket": {
      "primary": "https://ticket.softbankhawks.co.jp/game/select"
    }
  },
  {
    "date": "2026-05-14",
    "match": {
      "home": "DeNA",
      "visitor": "中日"
    },
    "info": {
      "stadium": "",
      "time": ""
    },
    "ticket": {
      "primary": "https://ticketsales.baystars.co.jp/calendar/2026/05",
      "resale": "https://ticket-resale.baystars.co.jp/purchase/match"
    }
  },
  {
    "date": "2026-05-14",
    "match": {
      "home": "楽天",
      "visitor": "オリックス"
    },
    "info": {
      "stadium": "",
      "time": ""
    },
    "ticket": {
      "primary": "https://eagles.tstar.jp/seat260514",
      "resale": "https://nft.rakuten.co.jp/marketplace/?type=ticket&sort=last_updated_date&limit=12&ticketlimit=6&provider=eagles&date=14-05-2026"
    }
  },
  {
    "date": "2026-05-14",
    "match": {
      "home": "ロッテ",
      "visitor": "日本ハム"
    },
    "info": {
      "stadium": "",
      "time": ""
    },
    "ticket": {
      "primary": "https://m-ticket.marines.co.jp/ticket/20260514",
      "resale": "https://www.ticket.co.jp/sys/k/79881.htm?st=20260514"
    }
  },
  {
    "date": "2026-05-15",
    "match": {
      "home": "巨人",
      "visitor": "DeNA"
    },
    "info": {
      "stadium": "",
      "time": ""
    },
    "ticket": {
      "primary": "https://www.giants.jp/schedule/first-team/?month=202605",
      "resale": "https://tradead.tixplus.jp/giants/buy/bidding?month=5&year=2026"
    }
  },
  {
    "date": "2026-05-15",
    "match": {
      "home": "中日",
      "visitor": "ヤクルト"
    },
    "info": {
      "stadium": "",
      "time": ""
    },
    "ticket": {
      "primary": "https://dragons-ticket.jp/Calendar.aspx",
      "resale": "https://tradead.tixplus.jp/dragons/buy/bidding?month=5&year=2026"
    }
  },
  {
    "date": "2026-05-15",
    "match": {
      "home": "阪神",
      "visitor": "広島"
    },
    "info": {
      "stadium": "",
      "time": ""
    },
    "ticket": {
      "primary": "https://hanshintigers.jp/ticket/detail/20260515.html"
    }
  },
  {
    "date": "2026-05-15",
    "match": {
      "home": "日本ハム",
      "visitor": "西武"
    },
    "info": {
      "stadium": "",
      "time": ""
    },
    "ticket": {
      "primary": "https://ticket.fighters.co.jp/event/list/self/1",
      "resale": "https://ticket.fighters.co.jp/event/list/resale/1"
    }
  },
  {
    "date": "2026-05-15",
    "match": {
      "home": "楽天",
      "visitor": "ソフトバンク"
    },
    "info": {
      "stadium": "",
      "time": ""
    },
    "ticket": {
      "primary": "https://eagles.tstar.jp/seat260515",
      "resale": "https://nft.rakuten.co.jp/marketplace/?type=ticket&sort=last_updated_date&limit=12&ticketlimit=6&provider=eagles&date=15-05-2026"
    }
  },
  {
    "date": "2026-05-15",
    "match": {
      "home": "ロッテ",
      "visitor": "オリックス"
    },
    "info": {
      "stadium": "",
      "time": ""
    },
    "ticket": {
      "primary": "https://m-ticket.marines.co.jp/ticket/20260515",
      "resale": "https://www.ticket.co.jp/sys/k/79881.htm?st=20260515"
    }
  },
  {
    "date": "2026-05-16",
    "match": {
      "home": "巨人",
      "visitor": "DeNA"
    },
    "info": {
      "stadium": "",
      "time": ""
    },
    "ticket": {
      "primary": "https://www.giants.jp/schedule/first-team/?month=202605",
      "resale": "https://tradead.tixplus.jp/giants/buy/bidding?month=5&year=2026"
    }
  },
  {
    "date": "2026-05-16",
    "match": {
      "home": "中日",
      "visitor": "ヤクルト"
    },
    "info": {
      "stadium": "",
      "time": ""
    },
    "ticket": {
      "primary": "https://dragons-ticket.jp/Calendar.aspx",
      "resale": "https://tradead.tixplus.jp/dragons/buy/bidding?month=5&year=2026"
    }
  },
  {
    "date": "2026-05-16",
    "match": {
      "home": "阪神",
      "visitor": "広島"
    },
    "info": {
      "stadium": "",
      "time": ""
    },
    "ticket": {
      "primary": "https://hanshintigers.jp/ticket/detail/20260516.html"
    }
  },
  {
    "date": "2026-05-16",
    "match": {
      "home": "日本ハム",
      "visitor": "西武"
    },
    "info": {
      "stadium": "",
      "time": ""
    },
    "ticket": {
      "primary": "https://ticket.fighters.co.jp/event/list/self/1",
      "resale": "https://ticket.fighters.co.jp/event/list/resale/1"
    }
  },
  {
    "date": "2026-05-16",
    "match": {
      "home": "楽天",
      "visitor": "ソフトバンク"
    },
    "info": {
      "stadium": "",
      "time": ""
    },
    "ticket": {
      "primary": "https://eagles.tstar.jp/seat260516",
      "resale": "https://nft.rakuten.co.jp/marketplace/?type=ticket&sort=last_updated_date&limit=12&ticketlimit=6&provider=eagles&date=16-05-2026"
    }
  },
  {
    "date": "2026-05-16",
    "match": {
      "home": "ロッテ",
      "visitor": "オリックス"
    },
    "info": {
      "stadium": "",
      "time": ""
    },
    "ticket": {
      "primary": "https://m-ticket.marines.co.jp/ticket/20260516",
      "resale": "https://www.ticket.co.jp/sys/k/79881.htm?st=20260516"
    }
  },
  {
    "date": "2026-05-17",
    "match": {
      "home": "巨人",
      "visitor": "DeNA"
    },
    "info": {
      "stadium": "",
      "time": ""
    },
    "ticket": {
      "primary": "https://www.giants.jp/schedule/first-team/?month=202605",
      "resale": "https://tradead.tixplus.jp/giants/buy/bidding?month=5&year=2026"
    }
  },
  {
    "date": "2026-05-17",
    "match": {
      "home": "中日",
      "visitor": "ヤクルト"
    },
    "info": {
      "stadium": "",
      "time": ""
    },
    "ticket": {
      "primary": "https://dragons-ticket.jp/Calendar.aspx",
      "resale": "https://tradead.tixplus.jp/dragons/buy/bidding?month=5&year=2026"
    }
  },
  {
    "date": "2026-05-17",
    "match": {
      "home": "阪神",
      "visitor": "広島"
    },
    "info": {
      "stadium": "",
      "time": ""
    },
    "ticket": {
      "primary": "https://hanshintigers.jp/ticket/detail/20260517.html"
    }
  },
  {
    "date": "2026-05-17",
    "match": {
      "home": "日本ハム",
      "visitor": "西武"
    },
    "info": {
      "stadium": "",
      "time": ""
    },
    "ticket": {
      "primary": "https://ticket.fighters.co.jp/event/list/self/1",
      "resale": "https://ticket.fighters.co.jp/event/list/resale/1"
    }
  },
  {
    "date": "2026-05-17",
    "match": {
      "home": "楽天",
      "visitor": "ソフトバンク"
    },
    "info": {
      "stadium": "",
      "time": ""
    },
    "ticket": {
      "primary": "https://eagles.tstar.jp/seat260517",
      "resale": "https://nft.rakuten.co.jp/marketplace/?type=ticket&sort=last_updated_date&limit=12&ticketlimit=6&provider=eagles&date=17-05-2026"
    }
  },
  {
    "date": "2026-05-17",
    "match": {
      "home": "ロッテ",
      "visitor": "オリックス"
    },
    "info": {
      "stadium": "",
      "time": ""
    },
    "ticket": {
      "primary": "https://m-ticket.marines.co.jp/ticket/20260517",
      "resale": "https://www.ticket.co.jp/sys/k/79881.htm?st=20260517"
    }
  },
  {
    "date": "2026-05-19",
    "match": {
      "home": "ヤクルト",
      "visitor": "巨人"
    },
    "info": {
      "stadium": "いわき",
      "time": ""
    },
    "ticket": {
      "primary": "https://ticket.yakult-swallows.co.jp/Calendar.aspx",
      "resale": "https://tradead.tixplus.jp/swallows/buy/bidding?month=5&year=2026"
    }
  },
  {
    "date": "2026-05-19",
    "match": {
      "home": "阪神",
      "visitor": "中日"
    },
    "info": {
      "stadium": "倉敷",
      "time": ""
    },
    "ticket": {
      "primary": "https://hanshintigers.jp/ticket/detail/20260519.html"
    }
  },
  {
    "date": "2026-05-19",
    "match": {
      "home": "広島",
      "visitor": "DeNA"
    },
    "info": {
      "stadium": "",
      "time": ""
    },
    "ticket": {
      "primary": "https://www.carp.co.jp/ticket/ticket/yoyaku_hoho.html"
    }
  },
  {
    "date": "2026-05-19",
    "match": {
      "home": "日本ハム",
      "visitor": "楽天"
    },
    "info": {
      "stadium": "",
      "time": ""
    },
    "ticket": {
      "primary": "https://ticket.fighters.co.jp/event/list/self/1",
      "resale": "https://ticket.fighters.co.jp/event/list/resale/1"
    }
  },
  {
    "date": "2026-05-19",
    "match": {
      "home": "西武",
      "visitor": "ロッテ"
    },
    "info": {
      "stadium": "前橋",
      "time": ""
    },
    "ticket": {
      "primary": "https://ticket.seibulions.jp/event/venue/26051901",
      "resale": [
        "https://ticket.seibulions.jp/resale/venue/26051901",
        "https://www.ticket.co.jp/sys/k/68848.htm?st=20260519"
      ]
    }
  },
  {
    "date": "2026-05-19",
    "match": {
      "home": "オリックス",
      "visitor": "ソフトバンク"
    },
    "info": {
      "stadium": "",
      "time": ""
    },
    "ticket": {
      "primary": "https://buffaloes.cnplayguide.com/ticket/20260519",
      "resale": "https://www.ticket.co.jp/sys/k/79911.htm?st=20260519"
    }
  },
  {
    "date": "2026-05-20",
    "match": {
      "home": "阪神",
      "visitor": "中日"
    },
    "info": {
      "stadium": "",
      "time": ""
    },
    "ticket": {
      "primary": "https://hanshintigers.jp/ticket/detail/20260520.html"
    }
  },
  {
    "date": "2026-05-20",
    "match": {
      "home": "広島",
      "visitor": "DeNA"
    },
    "info": {
      "stadium": "",
      "time": ""
    },
    "ticket": {
      "primary": "https://www.carp.co.jp/ticket/ticket/yoyaku_hoho.html"
    }
  },
  {
    "date": "2026-05-20",
    "match": {
      "home": "日本ハム",
      "visitor": "楽天"
    },
    "info": {
      "stadium": "",
      "time": ""
    },
    "ticket": {
      "primary": "https://ticket.fighters.co.jp/event/list/self/1",
      "resale": "https://ticket.fighters.co.jp/event/list/resale/1"
    }
  },
  {
    "date": "2026-05-20",
    "match": {
      "home": "西武",
      "visitor": "ロッテ"
    },
    "info": {
      "stadium": "県営大宮",
      "time": ""
    },
    "ticket": {
      "primary": "https://ticket.seibulions.jp/event/venue/26052001",
      "resale": [
        "https://ticket.seibulions.jp/resale/venue/26052001",
        "https://www.ticket.co.jp/sys/k/68848.htm?st=20260520"
      ]
    }
  },
  {
    "date": "2026-05-20",
    "match": {
      "home": "オリックス",
      "visitor": "ソフトバンク"
    },
    "info": {
      "stadium": "",
      "time": ""
    },
    "ticket": {
      "primary": "https://buffaloes.cnplayguide.com/ticket/20260520",
      "resale": "https://www.ticket.co.jp/sys/k/79911.htm?st=20260520"
    }
  },
  {
    "date": "2026-05-21",
    "match": {
      "home": "ヤクルト",
      "visitor": "巨人"
    },
    "info": {
      "stadium": "",
      "time": ""
    },
    "ticket": {
      "primary": "https://ticket.yakult-swallows.co.jp/Calendar.aspx",
      "resale": "https://tradead.tixplus.jp/swallows/buy/bidding?month=5&year=2026"
    }
  },
  {
    "date": "2026-05-21",
    "match": {
      "home": "阪神",
      "visitor": "中日"
    },
    "info": {
      "stadium": "",
      "time": ""
    },
    "ticket": {
      "primary": "https://hanshintigers.jp/ticket/detail/20260521.html"
    }
  },
  {
    "date": "2026-05-21",
    "match": {
      "home": "広島",
      "visitor": "DeNA"
    },
    "info": {
      "stadium": "",
      "time": ""
    },
    "ticket": {
      "primary": "https://www.carp.co.jp/ticket/ticket/yoyaku_hoho.html"
    }
  },
  {
    "date": "2026-05-22",
    "match": {
      "home": "巨人",
      "visitor": "阪神"
    },
    "info": {
      "stadium": "",
      "time": ""
    },
    "ticket": {
      "primary": "https://www.giants.jp/schedule/first-team/?month=202605",
      "resale": "https://tradead.tixplus.jp/giants/buy/bidding?month=5&year=2026"
    }
  },
  {
    "date": "2026-05-22",
    "match": {
      "home": "中日",
      "visitor": "広島"
    },
    "info": {
      "stadium": "",
      "time": ""
    },
    "ticket": {
      "primary": "https://dragons-ticket.jp/Calendar.aspx",
      "resale": "https://tradead.tixplus.jp/dragons/buy/bidding?month=5&year=2026"
    }
  },
  {
    "date": "2026-05-22",
    "match": {
      "home": "楽天",
      "visitor": "ロッテ"
    },
    "info": {
      "stadium": "",
      "time": ""
    },
    "ticket": {
      "primary": "https://eagles.tstar.jp/seat260522",
      "resale": "https://nft.rakuten.co.jp/marketplace/?type=ticket&sort=last_updated_date&limit=12&ticketlimit=6&provider=eagles&date=22-05-2026"
    }
  },
  {
    "date": "2026-05-22",
    "match": {
      "home": "西武",
      "visitor": "オリックス"
    },
    "info": {
      "stadium": "",
      "time": ""
    },
    "ticket": {
      "primary": "https://ticket.seibulions.jp/event/venue/26052201",
      "resale": [
        "https://ticket.seibulions.jp/resale/venue/26052201",
        "https://www.ticket.co.jp/sys/k/68848.htm?st=20260522"
      ]
    }
  },
  {
    "date": "2026-05-22",
    "match": {
      "home": "ソフトバンク",
      "visitor": "日本ハム"
    },
    "info": {
      "stadium": "",
      "time": ""
    },
    "ticket": {
      "primary": "https://ticket.softbankhawks.co.jp/game/select"
    }
  },
  {
    "date": "2026-05-23",
    "match": {
      "home": "巨人",
      "visitor": "阪神"
    },
    "info": {
      "stadium": "",
      "time": ""
    },
    "ticket": {
      "primary": "https://www.giants.jp/schedule/first-team/?month=202605",
      "resale": "https://tradead.tixplus.jp/giants/buy/bidding?month=5&year=2026"
    }
  },
  {
    "date": "2026-05-23",
    "match": {
      "home": "DeNA",
      "visitor": "ヤクルト"
    },
    "info": {
      "stadium": "",
      "time": ""
    },
    "ticket": {
      "primary": "https://ticketsales.baystars.co.jp/calendar/2026/05",
      "resale": "https://ticket-resale.baystars.co.jp/purchase/match"
    }
  },
  {
    "date": "2026-05-23",
    "match": {
      "home": "中日",
      "visitor": "広島"
    },
    "info": {
      "stadium": "",
      "time": ""
    },
    "ticket": {
      "primary": "https://dragons-ticket.jp/Calendar.aspx",
      "resale": "https://tradead.tixplus.jp/dragons/buy/bidding?month=5&year=2026"
    }
  },
  {
    "date": "2026-05-23",
    "match": {
      "home": "楽天",
      "visitor": "ロッテ"
    },
    "info": {
      "stadium": "",
      "time": ""
    },
    "ticket": {
      "primary": "https://eagles.tstar.jp/seat260523",
      "resale": "https://nft.rakuten.co.jp/marketplace/?type=ticket&sort=last_updated_date&limit=12&ticketlimit=6&provider=eagles&date=23-05-2026"
    }
  },
  {
    "date": "2026-05-23",
    "match": {
      "home": "西武",
      "visitor": "オリックス"
    },
    "info": {
      "stadium": "",
      "time": ""
    },
    "ticket": {
      "primary": "https://ticket.seibulions.jp/event/venue/26052301",
      "resale": [
        "https://ticket.seibulions.jp/resale/venue/26052301",
        "https://www.ticket.co.jp/sys/k/68848.htm?st=20260523"
      ]
    }
  },
  {
    "date": "2026-05-23",
    "match": {
      "home": "ソフトバンク",
      "visitor": "日本ハム"
    },
    "info": {
      "stadium": "",
      "time": ""
    },
    "ticket": {
      "primary": "https://ticket.softbankhawks.co.jp/game/select"
    }
  },
  {
    "date": "2026-05-24",
    "match": {
      "home": "巨人",
      "visitor": "阪神"
    },
    "info": {
      "stadium": "",
      "time": ""
    },
    "ticket": {
      "primary": "https://www.giants.jp/schedule/first-team/?month=202605",
      "resale": "https://tradead.tixplus.jp/giants/buy/bidding?month=5&year=2026"
    }
  },
  {
    "date": "2026-05-24",
    "match": {
      "home": "DeNA",
      "visitor": "ヤクルト"
    },
    "info": {
      "stadium": "",
      "time": ""
    },
    "ticket": {
      "primary": "https://ticketsales.baystars.co.jp/calendar/2026/05",
      "resale": "https://ticket-resale.baystars.co.jp/purchase/match"
    }
  },
  {
    "date": "2026-05-24",
    "match": {
      "home": "中日",
      "visitor": "広島"
    },
    "info": {
      "stadium": "",
      "time": ""
    },
    "ticket": {
      "primary": "https://dragons-ticket.jp/Calendar.aspx",
      "resale": "https://tradead.tixplus.jp/dragons/buy/bidding?month=5&year=2026"
    }
  },
  {
    "date": "2026-05-24",
    "match": {
      "home": "楽天",
      "visitor": "ロッテ"
    },
    "info": {
      "stadium": "",
      "time": ""
    },
    "ticket": {
      "primary": "https://eagles.tstar.jp/seat260524",
      "resale": "https://nft.rakuten.co.jp/marketplace/?type=ticket&sort=last_updated_date&limit=12&ticketlimit=6&provider=eagles&date=24-05-2026"
    }
  },
  {
    "date": "2026-05-24",
    "match": {
      "home": "西武",
      "visitor": "オリックス"
    },
    "info": {
      "stadium": "",
      "time": ""
    },
    "ticket": {
      "primary": "https://ticket.seibulions.jp/event/venue/26052401",
      "resale": [
        "https://ticket.seibulions.jp/resale/venue/26052401",
        "https://www.ticket.co.jp/sys/k/68848.htm?st=20260524"
      ]
    }
  },
  {
    "date": "2026-05-24",
    "match": {
      "home": "ソフトバンク",
      "visitor": "日本ハム"
    },
    "info": {
      "stadium": "",
      "time": ""
    },
    "ticket": {
      "primary": "https://ticket.softbankhawks.co.jp/game/select"
    }
  },
  {
    "date": "2026-05-26",
    "match": {
      "home": "巨人",
      "visitor": "ソフトバンク"
    },
    "info": {
      "stadium": "",
      "time": ""
    },
    "ticket": {
      "primary": "https://www.giants.jp/schedule/first-team/?month=202605",
      "resale": "https://tradead.tixplus.jp/giants/buy/bidding?month=5&year=2026"
    }
  },
  {
    "date": "2026-05-26",
    "match": {
      "home": "ヤクルト",
      "visitor": "西武"
    },
    "info": {
      "stadium": "",
      "time": ""
    },
    "ticket": {
      "primary": "https://ticket.yakult-swallows.co.jp/Calendar.aspx",
      "resale": "https://tradead.tixplus.jp/swallows/buy/bidding?month=5&year=2026"
    }
  },
  {
    "date": "2026-05-26",
    "match": {
      "home": "DeNA",
      "visitor": "オリックス"
    },
    "info": {
      "stadium": "",
      "time": ""
    },
    "ticket": {
      "primary": "https://ticketsales.baystars.co.jp/calendar/2026/05",
      "resale": "https://ticket-resale.baystars.co.jp/purchase/match"
    }
  },
  {
    "date": "2026-05-26",
    "match": {
      "home": "中日",
      "visitor": "楽天"
    },
    "info": {
      "stadium": "",
      "time": ""
    },
    "ticket": {
      "primary": "https://dragons-ticket.jp/Calendar.aspx",
      "resale": "https://tradead.tixplus.jp/dragons/buy/bidding?month=5&year=2026"
    }
  },
  {
    "date": "2026-05-26",
    "match": {
      "home": "阪神",
      "visitor": "日本ハム"
    },
    "info": {
      "stadium": "",
      "time": ""
    },
    "ticket": {
      "primary": "https://hanshintigers.jp/ticket/detail/20260526.html"
    }
  },
  {
    "date": "2026-05-26",
    "match": {
      "home": "広島",
      "visitor": "ロッテ"
    },
    "info": {
      "stadium": "",
      "time": ""
    },
    "ticket": {
      "primary": "https://www.carp.co.jp/ticket/ticket/yoyaku_hoho.html"
    }
  },
  {
    "date": "2026-05-27",
    "match": {
      "home": "巨人",
      "visitor": "ソフトバンク"
    },
    "info": {
      "stadium": "",
      "time": ""
    },
    "ticket": {
      "primary": "https://www.giants.jp/schedule/first-team/?month=202605",
      "resale": "https://tradead.tixplus.jp/giants/buy/bidding?month=5&year=2026"
    }
  },
  {
    "date": "2026-05-27",
    "match": {
      "home": "ヤクルト",
      "visitor": "西武"
    },
    "info": {
      "stadium": "",
      "time": ""
    },
    "ticket": {
      "primary": "https://ticket.yakult-swallows.co.jp/Calendar.aspx",
      "resale": "https://tradead.tixplus.jp/swallows/buy/bidding?month=5&year=2026"
    }
  },
  {
    "date": "2026-05-27",
    "match": {
      "home": "DeNA",
      "visitor": "オリックス"
    },
    "info": {
      "stadium": "",
      "time": ""
    },
    "ticket": {
      "primary": "https://ticketsales.baystars.co.jp/calendar/2026/05",
      "resale": "https://ticket-resale.baystars.co.jp/purchase/match"
    }
  },
  {
    "date": "2026-05-27",
    "match": {
      "home": "中日",
      "visitor": "楽天"
    },
    "info": {
      "stadium": "",
      "time": ""
    },
    "ticket": {
      "primary": "https://dragons-ticket.jp/Calendar.aspx",
      "resale": "https://tradead.tixplus.jp/dragons/buy/bidding?month=5&year=2026"
    }
  },
  {
    "date": "2026-05-27",
    "match": {
      "home": "阪神",
      "visitor": "日本ハム"
    },
    "info": {
      "stadium": "",
      "time": ""
    },
    "ticket": {
      "primary": "https://hanshintigers.jp/ticket/detail/20260527.html"
    }
  },
  {
    "date": "2026-05-27",
    "match": {
      "home": "広島",
      "visitor": "ロッテ"
    },
    "info": {
      "stadium": "",
      "time": ""
    },
    "ticket": {
      "primary": "https://www.carp.co.jp/ticket/ticket/yoyaku_hoho.html"
    }
  },
  {
    "date": "2026-05-28",
    "match": {
      "home": "巨人",
      "visitor": "ソフトバンク"
    },
    "info": {
      "stadium": "",
      "time": ""
    },
    "ticket": {
      "primary": "https://www.giants.jp/schedule/first-team/?month=202605",
      "resale": "https://tradead.tixplus.jp/giants/buy/bidding?month=5&year=2026"
    }
  },
  {
    "date": "2026-05-28",
    "match": {
      "home": "ヤクルト",
      "visitor": "西武"
    },
    "info": {
      "stadium": "",
      "time": ""
    },
    "ticket": {
      "primary": "https://ticket.yakult-swallows.co.jp/Calendar.aspx",
      "resale": "https://tradead.tixplus.jp/swallows/buy/bidding?month=5&year=2026"
    }
  },
  {
    "date": "2026-05-28",
    "match": {
      "home": "DeNA",
      "visitor": "オリックス"
    },
    "info": {
      "stadium": "",
      "time": ""
    },
    "ticket": {
      "primary": "https://ticketsales.baystars.co.jp/calendar/2026/05",
      "resale": "https://ticket-resale.baystars.co.jp/purchase/match"
    }
  },
  {
    "date": "2026-05-28",
    "match": {
      "home": "中日",
      "visitor": "楽天"
    },
    "info": {
      "stadium": "",
      "time": ""
    },
    "ticket": {
      "primary": "https://dragons-ticket.jp/Calendar.aspx",
      "resale": "https://tradead.tixplus.jp/dragons/buy/bidding?month=5&year=2026"
    }
  },
  {
    "date": "2026-05-28",
    "match": {
      "home": "阪神",
      "visitor": "日本ハム"
    },
    "info": {
      "stadium": "",
      "time": ""
    },
    "ticket": {
      "primary": "https://hanshintigers.jp/ticket/detail/20260528.html"
    }
  },
  {
    "date": "2026-05-28",
    "match": {
      "home": "広島",
      "visitor": "ロッテ"
    },
    "info": {
      "stadium": "",
      "time": ""
    },
    "ticket": {
      "primary": "https://www.carp.co.jp/ticket/ticket/yoyaku_hoho.html"
    }
  },
  {
    "date": "2026-05-29",
    "match": {
      "home": "日本ハム",
      "visitor": "巨人"
    },
    "info": {
      "stadium": "",
      "time": ""
    },
    "ticket": {
      "primary": "https://ticket.fighters.co.jp/event/list/self/1",
      "resale": "https://ticket.fighters.co.jp/event/list/resale/1"
    }
  },
  {
    "date": "2026-05-29",
    "match": {
      "home": "楽天",
      "visitor": "ヤクルト"
    },
    "info": {
      "stadium": "",
      "time": ""
    },
    "ticket": {
      "primary": "https://eagles.tstar.jp/seat260529",
      "resale": "https://nft.rakuten.co.jp/marketplace/?type=ticket&sort=last_updated_date&limit=12&ticketlimit=6&provider=eagles&date=29-05-2026"
    }
  },
  {
    "date": "2026-05-29",
    "match": {
      "home": "西武",
      "visitor": "DeNA"
    },
    "info": {
      "stadium": "",
      "time": ""
    },
    "ticket": {
      "primary": "https://ticket.seibulions.jp/event/venue/26052901",
      "resale": [
        "https://ticket.seibulions.jp/resale/venue/26052901",
        "https://www.ticket.co.jp/sys/k/68848.htm?st=20260529"
      ]
    }
  },
  {
    "date": "2026-05-29",
    "match": {
      "home": "ロッテ",
      "visitor": "阪神"
    },
    "info": {
      "stadium": "",
      "time": ""
    },
    "ticket": {
      "primary": "https://m-ticket.marines.co.jp/ticket/20260529",
      "resale": "https://www.ticket.co.jp/sys/k/79881.htm?st=20260529"
    }
  },
  {
    "date": "2026-05-29",
    "match": {
      "home": "オリックス",
      "visitor": "中日"
    },
    "info": {
      "stadium": "",
      "time": ""
    },
    "ticket": {
      "primary": "https://buffaloes.cnplayguide.com/ticket/20260529",
      "resale": "https://www.ticket.co.jp/sys/k/79911.htm?st=20260529"
    }
  },
  {
    "date": "2026-05-29",
    "match": {
      "home": "ソフトバンク",
      "visitor": "広島"
    },
    "info": {
      "stadium": "",
      "time": ""
    },
    "ticket": {
      "primary": "https://ticket.softbankhawks.co.jp/game/select"
    }
  },
  {
    "date": "2026-05-30",
    "match": {
      "home": "日本ハム",
      "visitor": "巨人"
    },
    "info": {
      "stadium": "",
      "time": ""
    },
    "ticket": {
      "primary": "https://ticket.fighters.co.jp/event/list/self/1",
      "resale": "https://ticket.fighters.co.jp/event/list/resale/1"
    }
  },
  {
    "date": "2026-05-30",
    "match": {
      "home": "楽天",
      "visitor": "ヤクルト"
    },
    "info": {
      "stadium": "",
      "time": ""
    },
    "ticket": {
      "primary": "https://eagles.tstar.jp/seat260530",
      "resale": "https://nft.rakuten.co.jp/marketplace/?type=ticket&sort=last_updated_date&limit=12&ticketlimit=6&provider=eagles&date=30-05-2026"
    }
  },
  {
    "date": "2026-05-30",
    "match": {
      "home": "西武",
      "visitor": "DeNA"
    },
    "info": {
      "stadium": "",
      "time": ""
    },
    "ticket": {
      "primary": "https://ticket.seibulions.jp/event/venue/26053001",
      "resale": [
        "https://ticket.seibulions.jp/resale/venue/26053001",
        "https://www.ticket.co.jp/sys/k/68848.htm?st=20260530"
      ]
    }
  },
  {
    "date": "2026-05-30",
    "match": {
      "home": "ロッテ",
      "visitor": "阪神"
    },
    "info": {
      "stadium": "",
      "time": ""
    },
    "ticket": {
      "primary": "https://m-ticket.marines.co.jp/ticket/20260530",
      "resale": "https://www.ticket.co.jp/sys/k/79881.htm?st=20260530"
    }
  },
  {
    "date": "2026-05-30",
    "match": {
      "home": "オリックス",
      "visitor": "中日"
    },
    "info": {
      "stadium": "",
      "time": ""
    },
    "ticket": {
      "primary": "https://buffaloes.cnplayguide.com/ticket/20260530",
      "resale": "https://www.ticket.co.jp/sys/k/79911.htm?st=20260530"
    }
  },
  {
    "date": "2026-05-30",
    "match": {
      "home": "ソフトバンク",
      "visitor": "広島"
    },
    "info": {
      "stadium": "",
      "time": ""
    },
    "ticket": {
      "primary": "https://ticket.softbankhawks.co.jp/game/select"
    }
  },
  {
    "date": "2026-05-31",
    "match": {
      "home": "日本ハム",
      "visitor": "巨人"
    },
    "info": {
      "stadium": "",
      "time": ""
    },
    "ticket": {
      "primary": "https://ticket.fighters.co.jp/event/list/self/1",
      "resale": "https://ticket.fighters.co.jp/event/list/resale/1"
    }
  },
  {
    "date": "2026-05-31",
    "match": {
      "home": "楽天",
      "visitor": "ヤクルト"
    },
    "info": {
      "stadium": "",
      "time": ""
    },
    "ticket": {
      "primary": "https://eagles.tstar.jp/seat260531",
      "resale": "https://nft.rakuten.co.jp/marketplace/?type=ticket&sort=last_updated_date&limit=12&ticketlimit=6&provider=eagles&date=31-05-2026"
    }
  },
  {
    "date": "2026-05-31",
    "match": {
      "home": "西武",
      "visitor": "DeNA"
    },
    "info": {
      "stadium": "",
      "time": ""
    },
    "ticket": {
      "primary": "https://ticket.seibulions.jp/event/venue/26053101",
      "resale": [
        "https://ticket.seibulions.jp/resale/venue/26053101",
        "https://www.ticket.co.jp/sys/k/68848.htm?st=20260531"
      ]
    }
  },
  {
    "date": "2026-05-31",
    "match": {
      "home": "ロッテ",
      "visitor": "阪神"
    },
    "info": {
      "stadium": "",
      "time": ""
    },
    "ticket": {
      "primary": "https://m-ticket.marines.co.jp/ticket/20260531",
      "resale": "https://www.ticket.co.jp/sys/k/79881.htm?st=20260531"
    }
  },
  {
    "date": "2026-05-31",
    "match": {
      "home": "オリックス",
      "visitor": "中日"
    },
    "info": {
      "stadium": "",
      "time": ""
    },
    "ticket": {
      "primary": "https://buffaloes.cnplayguide.com/ticket/20260531",
      "resale": "https://www.ticket.co.jp/sys/k/79911.htm?st=20260531"
    }
  },
  {
    "date": "2026-05-31",
    "match": {
      "home": "ソフトバンク",
      "visitor": "広島"
    },
    "info": {
      "stadium": "",
      "time": ""
    },
    "ticket": {
      "primary": "https://ticket.softbankhawks.co.jp/game/select"
    }
  }
]