[
  {
    "date": "2026-04-01",
    "match": {
      "home": "ヤクルト",
      "visitor": "広島"
    },
    "info": {
      "stadium": "",
      "time": ""
    },
    "ticket": {
      "primary": "https://ticket.yakult-swallows.co.jp/Calendar.aspx",
      "resale": "https://tradead.tixplus.jp/swallows/buy/bidding?month=4&year=2026"
    }
  },
  {
    "date": "2026-04-01",
    "match": {
      "home": "中日",
      "visitor": "巨人"
    },
    "info": {
      "stadium": "",
      "time": ""
    },
    "ticket": {
      "primary": "https://dragons-ticket.jp/Calendar.aspx",
      "resale": "https://tradead.tixplus.jp/dragons/buy/bidding?month=4&year=2026"
    }
  },
  {
    "date": "2026-04-01",
    "match": {
      "home": "阪神",
      "visitor": "DeNA"
    },
    "info": {
      "stadium": "京セラD大阪",
      "time": ""
    },
    "ticket": {
      "primary": "https://hanshintigers.jp/ticket/detail/20260401.html"
    }
  },
  {
    "date": "2026-04-01",
    "match": {
      "home": "日本ハム",
      "visitor": "ロッテ"
    },
    "info": {
      "stadium": "",
      "time": ""
    },
    "ticket": {
      "primary": "https://ticket.fighters.co.jp/event/list/self/1",
      "resale": "https://ticket.fighters.co.jp/event/list/resale/1"
    }
  },
  {
    "date": "2026-04-01",
    "match": {
      "home": "楽天",
      "visitor": "ソフトバンク"
    },
    "info": {
      "stadium": "",
      "time": ""
    },
    "ticket": {
      "primary": "https://eagles.tstar.jp/seat260401",
      "resale": "https://nft.rakuten.co.jp/marketplace/?type=ticket&sort=last_updated_date&limit=12&ticketlimit=6&provider=eagles&date=01-04-2026"
    }
  },
  {
    "date": "2026-04-01",
    "match": {
      "home": "西武",
      "visitor": "オリックス"
    },
    "info": {
      "stadium": "",
      "time": ""
    },
    "ticket": {
      "primary": "https://ticket.seibulions.jp/event/venue/26040101",
      "resale": [
        "https://ticket.seibulions.jp/resale/venue/26040101",
        "https://www.ticket.co.jp/sys/k/68848.htm?st=20260401"
      ]
    }
  },
  {
    "date": "2026-04-02",
    "match": {
      "home": "ヤクルト",
      "visitor": "広島"
    },
    "info": {
      "stadium": "",
      "time": ""
    },
    "ticket": {
      "primary": "https://ticket.yakult-swallows.co.jp/Calendar.aspx",
      "resale": "https://tradead.tixplus.jp/swallows/buy/bidding?month=4&year=2026"
    }
  },
  {
    "date": "2026-04-02",
    "match": {
      "home": "中日",
      "visitor": "巨人"
    },
    "info": {
      "stadium": "",
      "time": ""
    },
    "ticket": {
      "primary": "https://dragons-ticket.jp/Calendar.aspx",
      "resale": "https://tradead.tixplus.jp/dragons/buy/bidding?month=4&year=2026"
    }
  },
  {
    "date": "2026-04-02",
    "match": {
      "home": "阪神",
      "visitor": "DeNA"
    },
    "info": {
      "stadium": "京セラD大阪",
      "time": ""
    },
    "ticket": {
      "primary": "https://hanshintigers.jp/ticket/detail/20260402.html"
    }
  },
  {
    "date": "2026-04-02",
    "match": {
      "home": "日本ハム",
      "visitor": "ロッテ"
    },
    "info": {
      "stadium": "",
      "time": ""
    },
    "ticket": {
      "primary": "https://ticket.fighters.co.jp/event/list/self/1",
      "resale": "https://ticket.fighters.co.jp/event/list/resale/1"
    }
  },
  {
    "date": "2026-04-02",
    "match": {
      "home": "楽天",
      "visitor": "ソフトバンク"
    },
    "info": {
      "stadium": "",
      "time": ""
    },
    "ticket": {
      "primary": "https://eagles.tstar.jp/seat260402",
      "resale": "https://nft.rakuten.co.jp/marketplace/?type=ticket&sort=last_updated_date&limit=12&ticketlimit=6&provider=eagles&date=02-04-2026"
    }
  },
  {
    "date": "2026-04-02",
    "match": {
      "home": "西武",
      "visitor": "オリックス"
    },
    "info": {
      "stadium": "",
      "time": ""
    },
    "ticket": {
      "primary": "https://ticket.seibulions.jp/event/venue/26040201",
      "resale": [
        "https://ticket.seibulions.jp/resale/venue/26040201",
        "https://www.ticket.co.jp/sys/k/68848.htm?st=20260402"
      ]
    }
  },
  {
    "date": "2026-04-03",
    "match": {
      "home": "巨人",
      "visitor": "DeNA"
    },
    "info": {
      "stadium": "",
      "time": ""
    },
    "ticket": {
      "primary": "https://www.giants.jp/schedule/first-team/?month=202604",
      "resale": "https://tradead.tixplus.jp/giants/buy/bidding?month=4&year=2026"
    }
  },
  {
    "date": "2026-04-03",
    "match": {
      "home": "ヤクルト",
      "visitor": "中日"
    },
    "info": {
      "stadium": "",
      "time": ""
    },
    "ticket": {
      "primary": "https://ticket.yakult-swallows.co.jp/Calendar.aspx",
      "resale": "https://tradead.tixplus.jp/swallows/buy/bidding?month=4&year=2026"
    }
  },
  {
    "date": "2026-04-03",
    "match": {
      "home": "広島",
      "visitor": "阪神"
    },
    "info": {
      "stadium": "",
      "time": ""
    },
    "ticket": {
      "primary": "https://www.carp.co.jp/ticket/ticket/yoyaku_hoho.html"
    }
  },
  {
    "date": "2026-04-03",
    "match": {
      "home": "日本ハム",
      "visitor": "オリックス"
    },
    "info": {
      "stadium": "",
      "time": ""
    },
    "ticket": {
      "primary": "https://ticket.fighters.co.jp/event/list/self/1",
      "resale": "https://ticket.fighters.co.jp/event/list/resale/1"
    }
  },
  {
    "date": "2026-04-03",
    "match": {
      "home": "西武",
      "visitor": "楽天"
    },
    "info": {
      "stadium": "",
      "time": ""
    },
    "ticket": {
      "primary": "https://ticket.seibulions.jp/event/venue/26040301",
      "resale": [
        "https://ticket.seibulions.jp/resale/venue/26040301",
        "https://www.ticket.co.jp/sys/k/68848.htm?st=20260403"
      ]
    }
  },
  {
    "date": "2026-04-03",
    "match": {
      "home": "ロッテ",
      "visitor": "ソフトバンク"
    },
    "info": {
      "stadium": "",
      "time": ""
    },
    "ticket": {
      "primary": "https://m-ticket.marines.co.jp/ticket/20260403",
      "resale": "https://www.ticket.co.jp/sys/k/79881.htm?st=20260403"
    }
  },
  {
    "date": "2026-04-04",
    "match": {
      "home": "巨人",
      "visitor": "DeNA"
    },
    "info": {
      "stadium": "",
      "time": ""
    },
    "ticket": {
      "primary": "https://www.giants.jp/schedule/first-team/?month=202604",
      "resale": "https://tradead.tixplus.jp/giants/buy/bidding?month=4&year=2026"
    }
  },
  {
    "date": "2026-04-04",
    "match": {
      "home": "ヤクルト",
      "visitor": "中日"
    },
    "info": {
      "stadium": "",
      "time": ""
    },
    "ticket": {
      "primary": "https://ticket.yakult-swallows.co.jp/Calendar.aspx",
      "resale": "https://tradead.tixplus.jp/swallows/buy/bidding?month=4&year=2026"
    }
  },
  {
    "date": "2026-04-04",
    "match": {
      "home": "広島",
      "visitor": "阪神"
    },
    "info": {
      "stadium": "",
      "time": ""
    },
    "ticket": {
      "primary": "https://www.carp.co.jp/ticket/ticket/yoyaku_hoho.html"
    }
  },
  {
    "date": "2026-04-04",
    "match": {
      "home": "日本ハム",
      "visitor": "オリックス"
    },
    "info": {
      "stadium": "",
      "time": ""
    },
    "ticket": {
      "primary": "https://ticket.fighters.co.jp/event/list/self/1",
      "resale": "https://ticket.fighters.co.jp/event/list/resale/1"
    }
  },
  {
    "date": "2026-04-04",
    "match": {
      "home": "西武",
      "visitor": "楽天"
    },
    "info": {
      "stadium": "",
      "time": ""
    },
    "ticket": {
      "primary": "https://ticket.seibulions.jp/event/venue/26040401",
      "resale": [
        "https://ticket.seibulions.jp/resale/venue/26040401",
        "https://www.ticket.co.jp/sys/k/68848.htm?st=20260404"
      ]
    }
  },
  {
    "date": "2026-04-04",
    "match": {
      "home": "ロッテ",
      "visitor": "ソフトバンク"
    },
    "info": {
      "stadium": "",
      "time": ""
    },
    "ticket": {
      "primary": "https://m-ticket.marines.co.jp/ticket/20260404",
      "resale": "https://www.ticket.co.jp/sys/k/79881.htm?st=20260404"
    }
  },
  {
    "date": "2026-04-05",
    "match": {
      "home": "巨人",
      "visitor": "DeNA"
    },
    "info": {
      "stadium": "",
      "time": ""
    },
    "ticket": {
      "primary": "https://www.giants.jp/schedule/first-team/?month=202604",
      "resale": "https://tradead.tixplus.jp/giants/buy/bidding?month=4&year=2026"
    }
  },
  {
    "date": "2026-04-05",
    "match": {
      "home": "ヤクルト",
      "visitor": "中日"
    },
    "info": {
      "stadium": "",
      "time": ""
    },
    "ticket": {
      "primary": "https://ticket.yakult-swallows.co.jp/Calendar.aspx",
      "resale": "https://tradead.tixplus.jp/swallows/buy/bidding?month=4&year=2026"
    }
  },
  {
    "date": "2026-04-05",
    "match": {
      "home": "広島",
      "visitor": "阪神"
    },
    "info": {
      "stadium": "",
      "time": ""
    },
    "ticket": {
      "primary": "https://www.carp.co.jp/ticket/ticket/yoyaku_hoho.html"
    }
  },
  {
    "date": "2026-04-05",
    "match": {
      "home": "日本ハム",
      "visitor": "オリックス"
    },
    "info": {
      "stadium": "",
      "time": ""
    },
    "ticket": {
      "primary": "https://ticket.fighters.co.jp/event/list/self/1",
      "resale": "https://ticket.fighters.co.jp/event/list/resale/1"
    }
  },
  {
    "date": "2026-04-05",
    "match": {
      "home": "西武",
      "visitor": "楽天"
    },
    "info": {
      "stadium": "",
      "time": ""
    },
    "ticket": {
      "primary": "https://ticket.seibulions.jp/event/venue/26040501",
      "resale": [
        "https://ticket.seibulions.jp/resale/venue/26040501",
        "https://www.ticket.co.jp/sys/k/68848.htm?st=20260405"
      ]
    }
  },
  {
    "date": "2026-04-05",
    "match": {
      "home": "ロッテ",
      "visitor": "ソフトバンク"
    },
    "info": {
      "stadium": "",
      "time": ""
    },
    "ticket": {
      "primary": "https://m-ticket.marines.co.jp/ticket/20260405",
      "resale": "https://www.ticket.co.jp/sys/k/79881.htm?st=20260405"
    }
  },
  {
    "date": "2026-04-07",
    "match": {
      "home": "DeNA",
      "visitor": "中日"
    },
    "info": {
      "stadium": "",
      "time": ""
    },
    "ticket": {
      "primary": "https://ticketsales.baystars.co.jp/calendar/2026/04",
      "resale": "https://ticket-resale.baystars.co.jp/purchase/match"
    }
  },
  {
    "date": "2026-04-07",
    "match": {
      "home": "阪神",
      "visitor": "ヤクルト"
    },
    "info": {
      "stadium": "",
      "time": ""
    },
    "ticket": {
      "primary": "https://hanshintigers.jp/ticket/detail/20260407.html"
    }
  },
  {
    "date": "2026-04-07",
    "match": {
      "home": "広島",
      "visitor": "巨人"
    },
    "info": {
      "stadium": "",
      "time": ""
    },
    "ticket": {
      "primary": "https://www.carp.co.jp/ticket/ticket/yoyaku_hoho.html"
    }
  },
  {
    "date": "2026-04-07",
    "match": {
      "home": "楽天",
      "visitor": "日本ハム"
    },
    "info": {
      "stadium": "",
      "time": ""
    },
    "ticket": {
      "primary": "https://eagles.tstar.jp/seat260407",
      "resale": "https://nft.rakuten.co.jp/marketplace/?type=ticket&sort=last_updated_date&limit=12&ticketlimit=6&provider=eagles&date=07-04-2026"
    }
  },
  {
    "date": "2026-04-07",
    "match": {
      "home": "オリックス",
      "visitor": "ロッテ"
    },
    "info": {
      "stadium": "",
      "time": ""
    },
    "ticket": {
      "primary": "https://buffaloes.cnplayguide.com/ticket/20260407",
      "resale": "https://www.ticket.co.jp/sys/k/79911.htm?st=20260407"
    }
  },
  {
    "date": "2026-04-07",
    "match": {
      "home": "ソフトバンク",
      "visitor": "西武"
    },
    "info": {
      "stadium": "",
      "time": ""
    },
    "ticket": {
      "primary": "https://ticket.softbankhawks.co.jp/game/select"
    }
  },
  {
    "date": "2026-04-08",
    "match": {
      "home": "DeNA",
      "visitor": "中日"
    },
    "info": {
      "stadium": "",
      "time": ""
    },
    "ticket": {
      "primary": "https://ticketsales.baystars.co.jp/calendar/2026/04",
      "resale": "https://ticket-resale.baystars.co.jp/purchase/match"
    }
  },
  {
    "date": "2026-04-08",
    "match": {
      "home": "阪神",
      "visitor": "ヤクルト"
    },
    "info": {
      "stadium": "",
      "time": ""
    },
    "ticket": {
      "primary": "https://hanshintigers.jp/ticket/detail/20260408.html"
    }
  },
  {
    "date": "2026-04-08",
    "match": {
      "home": "広島",
      "visitor": "巨人"
    },
    "info": {
      "stadium": "",
      "time": ""
    },
    "ticket": {
      "primary": "https://www.carp.co.jp/ticket/ticket/yoyaku_hoho.html"
    }
  },
  {
    "date": "2026-04-08",
    "match": {
      "home": "楽天",
      "visitor": "日本ハム"
    },
    "info": {
      "stadium": "",
      "time": ""
    },
    "ticket": {
      "primary": "https://eagles.tstar.jp/seat260408",
      "resale": "https://nft.rakuten.co.jp/marketplace/?type=ticket&sort=last_updated_date&limit=12&ticketlimit=6&provider=eagles&date=08-04-2026"
    }
  },
  {
    "date": "2026-04-08",
    "match": {
      "home": "オリックス",
      "visitor": "ロッテ"
    },
    "info": {
      "stadium": "",
      "time": ""
    },
    "ticket": {
      "primary": "https://buffaloes.cnplayguide.com/ticket/20260408",
      "resale": "https://www.ticket.co.jp/sys/k/79911.htm?st=20260408"
    }
  },
  {
    "date": "2026-04-08",
    "match": {
      "home": "ソフトバンク",
      "visitor": "西武"
    },
    "info": {
      "stadium": "",
      "time": ""
    },
    "ticket": {
      "primary": "https://ticket.softbankhawks.co.jp/game/select"
    }
  },
  {
    "date": "2026-04-09",
    "match": {
      "home": "阪神",
      "visitor": "ヤクルト"
    },
    "info": {
      "stadium": "",
      "time": ""
    },
    "ticket": {
      "primary": "https://hanshintigers.jp/ticket/detail/20260409.html"
    }
  },
  {
    "date": "2026-04-09",
    "match": {
      "home": "広島",
      "visitor": "巨人"
    },
    "info": {
      "stadium": "",
      "time": ""
    },
    "ticket": {
      "primary": "https://www.carp.co.jp/ticket/ticket/yoyaku_hoho.html"
    }
  },
  {
    "date": "2026-04-09",
    "match": {
      "home": "楽天",
      "visitor": "日本ハム"
    },
    "info": {
      "stadium": "",
      "time": ""
    },
    "ticket": {
      "primary": "https://eagles.tstar.jp/seat260409",
      "resale": "https://nft.rakuten.co.jp/marketplace/?type=ticket&sort=last_updated_date&limit=12&ticketlimit=6&provider=eagles&date=09-04-2026"
    }
  },
  {
    "date": "2026-04-09",
    "match": {
      "home": "オリックス",
      "visitor": "ロッテ"
    },
    "info": {
      "stadium": "",
      "time": ""
    },
    "ticket": {
      "primary": "https://buffaloes.cnplayguide.com/ticket/20260409",
      "resale": "https://www.ticket.co.jp/sys/k/79911.htm?st=20260409"
    }
  },
  {
    "date": "2026-04-09",
    "match": {
      "home": "ソフトバンク",
      "visitor": "西武"
    },
    "info": {
      "stadium": "",
      "time": ""
    },
    "ticket": {
      "primary": "https://ticket.softbankhawks.co.jp/game/select"
    }
  },
  {
    "date": "2026-04-10",
    "match": {
      "home": "巨人",
      "visitor": "ヤクルト"
    },
    "info": {
      "stadium": "",
      "time": ""
    },
    "ticket": {
      "primary": "https://www.giants.jp/schedule/first-team/?month=202604",
      "resale": "https://tradead.tixplus.jp/giants/buy/bidding?month=4&year=2026"
    }
  },
  {
    "date": "2026-04-10",
    "match": {
      "home": "DeNA",
      "visitor": "広島"
    },
    "info": {
      "stadium": "",
      "time": ""
    },
    "ticket": {
      "primary": "https://ticketsales.baystars.co.jp/calendar/2026/04",
      "resale": "https://ticket-resale.baystars.co.jp/purchase/match"
    }
  },
  {
    "date": "2026-04-10",
    "match": {
      "home": "中日",
      "visitor": "阪神"
    },
    "info": {
      "stadium": "",
      "time": ""
    },
    "ticket": {
      "primary": "https://dragons-ticket.jp/Calendar.aspx",
      "resale": "https://tradead.tixplus.jp/dragons/buy/bidding?month=4&year=2026"
    }
  },
  {
    "date": "2026-04-10",
    "match": {
      "home": "楽天",
      "visitor": "オリックス"
    },
    "info": {
      "stadium": "",
      "time": ""
    },
    "ticket": {
      "primary": "https://eagles.tstar.jp/seat260410",
      "resale": "https://nft.rakuten.co.jp/marketplace/?type=ticket&sort=last_updated_date&limit=12&ticketlimit=6&provider=eagles&date=10-04-2026"
    }
  },
  {
    "date": "2026-04-10",
    "match": {
      "home": "西武",
      "visitor": "ロッテ"
    },
    "info": {
      "stadium": "県営大宮",
      "time": ""
    },
    "ticket": {
      "primary": "https://ticket.seibulions.jp/event/venue/26041001",
      "resale": [
        "https://ticket.seibulions.jp/resale/venue/26041001",
        "https://www.ticket.co.jp/sys/k/68848.htm?st=20260410"
      ]
    }
  },
  {
    "date": "2026-04-11",
    "match": {
      "home": "巨人",
      "visitor": "ヤクルト"
    },
    "info": {
      "stadium": "",
      "time": ""
    },
    "ticket": {
      "primary": "https://www.giants.jp/schedule/first-team/?month=202604",
      "resale": "https://tradead.tixplus.jp/giants/buy/bidding?month=4&year=2026"
    }
  },
  {
    "date": "2026-04-11",
    "match": {
      "home": "DeNA",
      "visitor": "広島"
    },
    "info": {
      "stadium": "",
      "time": ""
    },
    "ticket": {
      "primary": "https://ticketsales.baystars.co.jp/calendar/2026/04",
      "resale": "https://ticket-resale.baystars.co.jp/purchase/match"
    }
  },
  {
    "date": "2026-04-11",
    "match": {
      "home": "中日",
      "visitor": "阪神"
    },
    "info": {
      "stadium": "",
      "time": ""
    },
    "ticket": {
      "primary": "https://dragons-ticket.jp/Calendar.aspx",
      "resale": "https://tradead.tixplus.jp/dragons/buy/bidding?month=4&year=2026"
    }
  },
  {
    "date": "2026-04-11",
    "match": {
      "home": "日本ハム",
      "visitor": "ソフトバンク"
    },
    "info": {
      "stadium": "",
      "time": ""
    },
    "ticket": {
      "primary": "https://ticket.fighters.co.jp/event/list/self/1",
      "resale": "https://ticket.fighters.co.jp/event/list/resale/1"
    }
  },
  {
    "date": "2026-04-11",
    "match": {
      "home": "楽天",
      "visitor": "オリックス"
    },
    "info": {
      "stadium": "",
      "time": ""
    },
    "ticket": {
      "primary": "https://eagles.tstar.jp/seat260411",
      "resale": "https://nft.rakuten.co.jp/marketplace/?type=ticket&sort=last_updated_date&limit=12&ticketlimit=6&provider=eagles&date=11-04-2026"
    }
  },
  {
    "date": "2026-04-11",
    "match": {
      "home": "西武",
      "visitor": "ロッテ"
    },
    "info": {
      "stadium": "",
      "time": ""
    },
    "ticket": {
      "primary": "https://ticket.seibulions.jp/event/venue/26041101",
      "resale": [
        "https://ticket.seibulions.jp/resale/venue/26041101",
        "https://www.ticket.co.jp/sys/k/68848.htm?st=20260411"
      ]
    }
  },
  {
    "date": "2026-04-12",
    "match": {
      "home": "巨人",
      "visitor": "ヤクルト"
    },
    "info": {
      "stadium": "",
      "time": ""
    },
    "ticket": {
      "primary": "https://www.giants.jp/schedule/first-team/?month=202604",
      "resale": "https://tradead.tixplus.jp/giants/buy/bidding?month=4&year=2026"
    }
  },
  {
    "date": "2026-04-12",
    "match": {
      "home": "DeNA",
      "visitor": "広島"
    },
    "info": {
      "stadium": "",
      "time": ""
    },
    "ticket": {
      "primary": "https://ticketsales.baystars.co.jp/calendar/2026/04",
      "resale": "https://ticket-resale.baystars.co.jp/purchase/match"
    }
  },
  {
    "date": "2026-04-12",
    "match": {
      "home": "中日",
      "visitor": "阪神"
    },
    "info": {
      "stadium": "",
      "time": ""
    },
    "ticket": {
      "primary": "https://dragons-ticket.jp/Calendar.aspx",
      "resale": "https://tradead.tixplus.jp/dragons/buy/bidding?month=4&year=2026"
    }
  },
  {
    "date": "2026-04-12",
    "match": {
      "home": "日本ハム",
      "visitor": "ソフトバンク"
    },
    "info": {
      "stadium": "",
      "time": ""
    },
    "ticket": {
      "primary": "https://ticket.fighters.co.jp/event/list/self/1",
      "resale": "https://ticket.fighters.co.jp/event/list/resale/1"
    }
  },
  {
    "date": "2026-04-12",
    "match": {
      "home": "楽天",
      "visitor": "オリックス"
    },
    "info": {
      "stadium": "",
      "time": ""
    },
    "ticket": {
      "primary": "https://eagles.tstar.jp/seat260412",
      "resale": "https://nft.rakuten.co.jp/marketplace/?type=ticket&sort=last_updated_date&limit=12&ticketlimit=6&provider=eagles&date=12-04-2026"
    }
  },
  {
    "date": "2026-04-12",
    "match": {
      "home": "西武",
      "visitor": "ロッテ"
    },
    "info": {
      "stadium": "",
      "time": ""
    },
    "ticket": {
      "primary": "https://ticket.seibulions.jp/event/venue/26041201",
      "resale": [
        "https://ticket.seibulions.jp/resale/venue/26041201",
        "https://www.ticket.co.jp/sys/k/68848.htm?st=20260412"
      ]
    }
  },
  {
    "date": "2026-04-14",
    "match": {
      "home": "ヤクルト",
      "visitor": "DeNA"
    },
    "info": {
      "stadium": "松山",
      "time": ""
    },
    "ticket": {
      "primary": "https://ticket.yakult-swallows.co.jp/Calendar.aspx",
      "resale": "https://tradead.tixplus.jp/swallows/buy/bidding?month=4&year=2026"
    }
  },
  {
    "date": "2026-04-14",
    "match": {
      "home": "中日",
      "visitor": "広島"
    },
    "info": {
      "stadium": "豊橋",
      "time": ""
    },
    "ticket": {
      "primary": "https://dragons-ticket.jp/Calendar.aspx",
      "resale": "https://tradead.tixplus.jp/dragons/buy/bidding?month=4&year=2026"
    }
  },
  {
    "date": "2026-04-14",
    "match": {
      "home": "阪神",
      "visitor": "巨人"
    },
    "info": {
      "stadium": "",
      "time": ""
    },
    "ticket": {
      "primary": "https://hanshintigers.jp/ticket/detail/20260414.html"
    }
  },
  {
    "date": "2026-04-14",
    "match": {
      "home": "ロッテ",
      "visitor": "日本ハム"
    },
    "info": {
      "stadium": "",
      "time": ""
    },
    "ticket": {
      "primary": "https://m-ticket.marines.co.jp/ticket/20260414",
      "resale": "https://www.ticket.co.jp/sys/k/79881.htm?st=20260414"
    }
  },
  {
    "date": "2026-04-14",
    "match": {
      "home": "オリックス",
      "visitor": "西武"
    },
    "info": {
      "stadium": "",
      "time": ""
    },
    "ticket": {
      "primary": "https://buffaloes.cnplayguide.com/ticket/20260414",
      "resale": "https://www.ticket.co.jp/sys/k/79911.htm?st=20260414"
    }
  },
  {
    "date": "2026-04-14",
    "match": {
      "home": "ソフトバンク",
      "visitor": "楽天"
    },
    "info": {
      "stadium": "",
      "time": ""
    },
    "ticket": {
      "primary": "https://ticket.softbankhawks.co.jp/game/select"
    }
  },
  {
    "date": "2026-04-15",
    "match": {
      "home": "中日",
      "visitor": "広島"
    },
    "info": {
      "stadium": "",
      "time": ""
    },
    "ticket": {
      "primary": "https://dragons-ticket.jp/Calendar.aspx",
      "resale": "https://tradead.tixplus.jp/dragons/buy/bidding?month=4&year=2026"
    }
  },
  {
    "date": "2026-04-15",
    "match": {
      "home": "阪神",
      "visitor": "巨人"
    },
    "info": {
      "stadium": "",
      "time": ""
    },
    "ticket": {
      "primary": "https://hanshintigers.jp/ticket/detail/20260415.html"
    }
  },
  {
    "date": "2026-04-15",
    "match": {
      "home": "ロッテ",
      "visitor": "日本ハム"
    },
    "info": {
      "stadium": "",
      "time": ""
    },
    "ticket": {
      "primary": "https://m-ticket.marines.co.jp/ticket/20260415",
      "resale": "https://www.ticket.co.jp/sys/k/79881.htm?st=20260415"
    }
  },
  {
    "date": "2026-04-15",
    "match": {
      "home": "オリックス",
      "visitor": "西武"
    },
    "info": {
      "stadium": "",
      "time": ""
    },
    "ticket": {
      "primary": "https://buffaloes.cnplayguide.com/ticket/20260415",
      "resale": "https://www.ticket.co.jp/sys/k/79911.htm?st=20260415"
    }
  },
  {
    "date": "2026-04-15",
    "match": {
      "home": "ソフトバンク",
      "visitor": "楽天"
    },
    "info": {
      "stadium": "",
      "time": ""
    },
    "ticket": {
      "primary": "https://ticket.softbankhawks.co.jp/game/select"
    }
  },
  {
    "date": "2026-04-16",
    "match": {
      "home": "ヤクルト",
      "visitor": "DeNA"
    },
    "info": {
      "stadium": "",
      "time": ""
    },
    "ticket": {
      "primary": "https://ticket.yakult-swallows.co.jp/Calendar.aspx",
      "resale": "https://tradead.tixplus.jp/swallows/buy/bidding?month=4&year=2026"
    }
  },
  {
    "date": "2026-04-16",
    "match": {
      "home": "阪神",
      "visitor": "巨人"
    },
    "info": {
      "stadium": "",
      "time": ""
    },
    "ticket": {
      "primary": "https://hanshintigers.jp/ticket/detail/20260416.html"
    }
  },
  {
    "date": "2026-04-16",
    "match": {
      "home": "ロッテ",
      "visitor": "日本ハム"
    },
    "info": {
      "stadium": "",
      "time": ""
    },
    "ticket": {
      "primary": "https://m-ticket.marines.co.jp/ticket/20260416",
      "resale": "https://www.ticket.co.jp/sys/k/79881.htm?st=20260416"
    }
  },
  {
    "date": "2026-04-16",
    "match": {
      "home": "オリックス",
      "visitor": "西武"
    },
    "info": {
      "stadium": "",
      "time": ""
    },
    "ticket": {
      "primary": "https://buffaloes.cnplayguide.com/ticket/20260416",
      "resale": "https://www.ticket.co.jp/sys/k/79911.htm?st=20260416"
    }
  },
  {
    "date": "2026-04-16",
    "match": {
      "home": "ソフトバンク",
      "visitor": "楽天"
    },
    "info": {
      "stadium": "",
      "time": ""
    },
    "ticket": {
      "primary": "https://ticket.softbankhawks.co.jp/game/select"
    }
  },
  {
    "date": "2026-04-17",
    "match": {
      "home": "ヤクルト",
      "visitor": "巨人"
    },
    "info": {
      "stadium": "",
      "time": ""
    },
    "ticket": {
      "primary": "https://ticket.yakult-swallows.co.jp/Calendar.aspx",
      "resale": "https://tradead.tixplus.jp/swallows/buy/bidding?month=4&year=2026"
    }
  },
  {
    "date": "2026-04-17",
    "match": {
      "home": "阪神",
      "visitor": "中日"
    },
    "info": {
      "stadium": "",
      "time": ""
    },
    "ticket": {
      "primary": "https://hanshintigers.jp/ticket/detail/20260417.html"
    }
  },
  {
    "date": "2026-04-17",
    "match": {
      "home": "広島",
      "visitor": "DeNA"
    },
    "info": {
      "stadium": "",
      "time": ""
    },
    "ticket": {
      "primary": "https://www.carp.co.jp/ticket/ticket/yoyaku_hoho.html"
    }
  },
  {
    "date": "2026-04-17",
    "match": {
      "home": "日本ハム",
      "visitor": "西武"
    },
    "info": {
      "stadium": "",
      "time": ""
    },
    "ticket": {
      "primary": "https://ticket.fighters.co.jp/event/list/self/1",
      "resale": "https://ticket.fighters.co.jp/event/list/resale/1"
    }
  },
  {
    "date": "2026-04-17",
    "match": {
      "home": "楽天",
      "visitor": "ロッテ"
    },
    "info": {
      "stadium": "",
      "time": ""
    },
    "ticket": {
      "primary": "https://eagles.tstar.jp/seat260417",
      "resale": "https://nft.rakuten.co.jp/marketplace/?type=ticket&sort=last_updated_date&limit=12&ticketlimit=6&provider=eagles&date=17-04-2026"
    }
  },
  {
    "date": "2026-04-17",
    "match": {
      "home": "ソフトバンク",
      "visitor": "オリックス"
    },
    "info": {
      "stadium": "",
      "time": ""
    },
    "ticket": {
      "primary": "https://ticket.softbankhawks.co.jp/game/select"
    }
  },
  {
    "date": "2026-04-18",
    "match": {
      "home": "ヤクルト",
      "visitor": "巨人"
    },
    "info": {
      "stadium": "",
      "time": ""
    },
    "ticket": {
      "primary": "https://ticket.yakult-swallows.co.jp/Calendar.aspx",
      "resale": "https://tradead.tixplus.jp/swallows/buy/bidding?month=4&year=2026"
    }
  },
  {
    "date": "2026-04-18",
    "match": {
      "home": "阪神",
      "visitor": "中日"
    },
    "info": {
      "stadium": "",
      "time": ""
    },
    "ticket": {
      "primary": "https://hanshintigers.jp/ticket/detail/20260418.html"
    }
  },
  {
    "date": "2026-04-18",
    "match": {
      "home": "広島",
      "visitor": "DeNA"
    },
    "info": {
      "stadium": "",
      "time": ""
    },
    "ticket": {
      "primary": "https://www.carp.co.jp/ticket/ticket/yoyaku_hoho.html"
    }
  },
  {
    "date": "2026-04-18",
    "match": {
      "home": "日本ハム",
      "visitor": "西武"
    },
    "info": {
      "stadium": "",
      "time": ""
    },
    "ticket": {
      "primary": "https://ticket.fighters.co.jp/event/list/self/1",
      "resale": "https://ticket.fighters.co.jp/event/list/resale/1"
    }
  },
  {
    "date": "2026-04-18",
    "match": {
      "home": "楽天",
      "visitor": "ロッテ"
    },
    "info": {
      "stadium": "",
      "time": ""
    },
    "ticket": {
      "primary": "https://eagles.tstar.jp/seat260418",
      "resale": "https://nft.rakuten.co.jp/marketplace/?type=ticket&sort=last_updated_date&limit=12&ticketlimit=6&provider=eagles&date=18-04-2026"
    }
  },
  {
    "date": "2026-04-18",
    "match": {
      "home": "ソフトバンク",
      "visitor": "オリックス"
    },
    "info": {
      "stadium": "",
      "time": ""
    },
    "ticket": {
      "primary": "https://ticket.softbankhawks.co.jp/game/select"
    }
  },
  {
    "date": "2026-04-19",
    "match": {
      "home": "ヤクルト",
      "visitor": "巨人"
    },
    "info": {
      "stadium": "",
      "time": ""
    },
    "ticket": {
      "primary": "https://ticket.yakult-swallows.co.jp/Calendar.aspx",
      "resale": "https://tradead.tixplus.jp/swallows/buy/bidding?month=4&year=2026"
    }
  },
  {
    "date": "2026-04-19",
    "match": {
      "home": "阪神",
      "visitor": "中日"
    },
    "info": {
      "stadium": "",
      "time": ""
    },
    "ticket": {
      "primary": "https://hanshintigers.jp/ticket/detail/20260419.html"
    }
  },
  {
    "date": "2026-04-19",
    "match": {
      "home": "広島",
      "visitor": "DeNA"
    },
    "info": {
      "stadium": "",
      "time": ""
    },
    "ticket": {
      "primary": "https://www.carp.co.jp/ticket/ticket/yoyaku_hoho.html"
    }
  },
  {
    "date": "2026-04-19",
    "match": {
      "home": "日本ハム",
      "visitor": "西武"
    },
    "info": {
      "stadium": "",
      "time": ""
    },
    "ticket": {
      "primary": "https://ticket.fighters.co.jp/event/list/self/1",
      "resale": "https://ticket.fighters.co.jp/event/list/resale/1"
    }
  },
  {
    "date": "2026-04-19",
    "match": {
      "home": "楽天",
      "visitor": "ロッテ"
    },
    "info": {
      "stadium": "",
      "time": ""
    },
    "ticket": {
      "primary": "https://eagles.tstar.jp/seat260419",
      "resale": "https://nft.rakuten.co.jp/marketplace/?type=ticket&sort=last_updated_date&limit=12&ticketlimit=6&provider=eagles&date=19-04-2026"
    }
  },
  {
    "date": "2026-04-19",
    "match": {
      "home": "ソフトバンク",
      "visitor": "オリックス"
    },
    "info": {
      "stadium": "",
      "time": ""
    },
    "ticket": {
      "primary": "https://ticket.softbankhawks.co.jp/game/select"
    }
  },
  {
    "date": "2026-04-21",
    "match": {
      "home": "巨人",
      "visitor": "中日"
    },
    "info": {
      "stadium": "長野",
      "time": ""
    },
    "ticket": {
      "primary": "https://www.giants.jp/schedule/first-team/?month=202604",
      "resale": "https://tradead.tixplus.jp/giants/buy/bidding?month=4&year=2026"
    }
  },
  {
    "date": "2026-04-21",
    "match": {
      "home": "DeNA",
      "visitor": "阪神"
    },
    "info": {
      "stadium": "",
      "time": ""
    },
    "ticket": {
      "primary": "https://ticketsales.baystars.co.jp/calendar/2026/04",
      "resale": "https://ticket-resale.baystars.co.jp/purchase/match"
    }
  },
  {
    "date": "2026-04-21",
    "match": {
      "home": "広島",
      "visitor": "ヤクルト"
    },
    "info": {
      "stadium": "",
      "time": ""
    },
    "ticket": {
      "primary": "https://www.carp.co.jp/ticket/ticket/yoyaku_hoho.html"
    }
  },
  {
    "date": "2026-04-21",
    "match": {
      "home": "日本ハム",
      "visitor": "楽天"
    },
    "info": {
      "stadium": "",
      "time": ""
    },
    "ticket": {
      "primary": "https://ticket.fighters.co.jp/event/list/self/1",
      "resale": "https://ticket.fighters.co.jp/event/list/resale/1"
    }
  },
  {
    "date": "2026-04-21",
    "match": {
      "home": "西武",
      "visitor": "ソフトバンク"
    },
    "info": {
      "stadium": "",
      "time": ""
    },
    "ticket": {
      "primary": "https://ticket.seibulions.jp/event/venue/26042101",
      "resale": [
        "https://ticket.seibulions.jp/resale/venue/26042101",
        "https://www.ticket.co.jp/sys/k/68848.htm?st=20260421"
      ]
    }
  },
  {
    "date": "2026-04-21",
    "match": {
      "home": "ロッテ",
      "visitor": "オリックス"
    },
    "info": {
      "stadium": "",
      "time": ""
    },
    "ticket": {
      "primary": "https://m-ticket.marines.co.jp/ticket/20260421",
      "resale": "https://www.ticket.co.jp/sys/k/79881.htm?st=20260421"
    }
  },
  {
    "date": "2026-04-22",
    "match": {
      "home": "巨人",
      "visitor": "中日"
    },
    "info": {
      "stadium": "前橋",
      "time": ""
    },
    "ticket": {
      "primary": "https://www.giants.jp/schedule/first-team/?month=202604",
      "resale": "https://tradead.tixplus.jp/giants/buy/bidding?month=4&year=2026"
    }
  },
  {
    "date": "2026-04-22",
    "match": {
      "home": "DeNA",
      "visitor": "阪神"
    },
    "info": {
      "stadium": "",
      "time": ""
    },
    "ticket": {
      "primary": "https://ticketsales.baystars.co.jp/calendar/2026/04",
      "resale": "https://ticket-resale.baystars.co.jp/purchase/match"
    }
  },
  {
    "date": "2026-04-22",
    "match": {
      "home": "広島",
      "visitor": "ヤクルト"
    },
    "info": {
      "stadium": "",
      "time": ""
    },
    "ticket": {
      "primary": "https://www.carp.co.jp/ticket/ticket/yoyaku_hoho.html"
    }
  },
  {
    "date": "2026-04-22",
    "match": {
      "home": "日本ハム",
      "visitor": "楽天"
    },
    "info": {
      "stadium": "",
      "time": ""
    },
    "ticket": {
      "primary": "https://ticket.fighters.co.jp/event/list/self/1",
      "resale": "https://ticket.fighters.co.jp/event/list/resale/1"
    }
  },
  {
    "date": "2026-04-22",
    "match": {
      "home": "西武",
      "visitor": "ソフトバンク"
    },
    "info": {
      "stadium": "",
      "time": ""
    },
    "ticket": {
      "primary": "https://ticket.seibulions.jp/event/venue/26042201",
      "resale": [
        "https://ticket.seibulions.jp/resale/venue/26042201",
        "https://www.ticket.co.jp/sys/k/68848.htm?st=20260422"
      ]
    }
  },
  {
    "date": "2026-04-22",
    "match": {
      "home": "ロッテ",
      "visitor": "オリックス"
    },
    "info": {
      "stadium": "",
      "time": ""
    },
    "ticket": {
      "primary": "https://m-ticket.marines.co.jp/ticket/20260422",
      "resale": "https://www.ticket.co.jp/sys/k/79881.htm?st=20260422"
    }
  },
  {
    "date": "2026-04-23",
    "match": {
      "home": "DeNA",
      "visitor": "阪神"
    },
    "info": {
      "stadium": "",
      "time": ""
    },
    "ticket": {
      "primary": "https://ticketsales.baystars.co.jp/calendar/2026/04",
      "resale": "https://ticket-resale.baystars.co.jp/purchase/match"
    }
  },
  {
    "date": "2026-04-23",
    "match": {
      "home": "広島",
      "visitor": "ヤクルト"
    },
    "info": {
      "stadium": "",
      "time": ""
    },
    "ticket": {
      "primary": "https://www.carp.co.jp/ticket/ticket/yoyaku_hoho.html"
    }
  },
  {
    "date": "2026-04-23",
    "match": {
      "home": "日本ハム",
      "visitor": "楽天"
    },
    "info": {
      "stadium": "",
      "time": ""
    },
    "ticket": {
      "primary": "https://ticket.fighters.co.jp/event/list/self/1",
      "resale": "https://ticket.fighters.co.jp/event/list/resale/1"
    }
  },
  {
    "date": "2026-04-23",
    "match": {
      "home": "西武",
      "visitor": "ソフトバンク"
    },
    "info": {
      "stadium": "",
      "time": ""
    },
    "ticket": {
      "primary": "https://ticket.seibulions.jp/event/venue/26042301",
      "resale": [
        "https://ticket.seibulions.jp/resale/venue/26042301",
        "https://www.ticket.co.jp/sys/k/68848.htm?st=20260423"
      ]
    }
  },
  {
    "date": "2026-04-23",
    "match": {
      "home": "ロッテ",
      "visitor": "オリックス"
    },
    "info": {
      "stadium": "",
      "time": ""
    },
    "ticket": {
      "primary": "https://m-ticket.marines.co.jp/ticket/20260423",
      "resale": "https://www.ticket.co.jp/sys/k/79881.htm?st=20260423"
    }
  },
  {
    "date": "2026-04-24",
    "match": {
      "home": "DeNA",
      "visitor": "巨人"
    },
    "info": {
      "stadium": "",
      "time": ""
    },
    "ticket": {
      "primary": "https://ticketsales.baystars.co.jp/calendar/2026/04",
      "resale": "https://ticket-resale.baystars.co.jp/purchase/match"
    }
  },
  {
    "date": "2026-04-24",
    "match": {
      "home": "中日",
      "visitor": "ヤクルト"
    },
    "info": {
      "stadium": "",
      "time": ""
    },
    "ticket": {
      "primary": "https://dragons-ticket.jp/Calendar.aspx",
      "resale": "https://tradead.tixplus.jp/dragons/buy/bidding?month=4&year=2026"
    }
  },
  {
    "date": "2026-04-24",
    "match": {
      "home": "オリックス",
      "visitor": "日本ハム"
    },
    "info": {
      "stadium": "",
      "time": ""
    },
    "ticket": {
      "primary": "https://buffaloes.cnplayguide.com/ticket/20260424",
      "resale": "https://www.ticket.co.jp/sys/k/79911.htm?st=20260424"
    }
  },
  {
    "date": "2026-04-25",
    "match": {
      "home": "DeNA",
      "visitor": "巨人"
    },
    "info": {
      "stadium": "",
      "time": ""
    },
    "ticket": {
      "primary": "https://ticketsales.baystars.co.jp/calendar/2026/04",
      "resale": "https://ticket-resale.baystars.co.jp/purchase/match"
    }
  },
  {
    "date": "2026-04-25",
    "match": {
      "home": "中日",
      "visitor": "ヤクルト"
    },
    "info": {
      "stadium": "",
      "time": ""
    },
    "ticket": {
      "primary": "https://dragons-ticket.jp/Calendar.aspx",
      "resale": "https://tradead.tixplus.jp/dragons/buy/bidding?month=4&year=2026"
    }
  },
  {
    "date": "2026-04-25",
    "match": {
      "home": "阪神",
      "visitor": "広島"
    },
    "info": {
      "stadium": "",
      "time": ""
    },
    "ticket": {
      "primary": "https://hanshintigers.jp/ticket/detail/20260425.html"
    }
  },
  {
    "date": "2026-04-25",
    "match": {
      "home": "楽天",
      "visitor": "西武"
    },
    "info": {
      "stadium": "",
      "time": ""
    },
    "ticket": {
      "primary": "https://eagles.tstar.jp/seat260425",
      "resale": "https://nft.rakuten.co.jp/marketplace/?type=ticket&sort=last_updated_date&limit=12&ticketlimit=6&provider=eagles&date=25-04-2026"
    }
  },
  {
    "date": "2026-04-25",
    "match": {
      "home": "オリックス",
      "visitor": "日本ハム"
    },
    "info": {
      "stadium": "",
      "time": ""
    },
    "ticket": {
      "primary": "https://buffaloes.cnplayguide.com/ticket/20260425",
      "resale": "https://www.ticket.co.jp/sys/k/79911.htm?st=20260425"
    }
  },
  {
    "date": "2026-04-25",
    "match": {
      "home": "ソフトバンク",
      "visitor": "ロッテ"
    },
    "info": {
      "stadium": "",
      "time": ""
    },
    "ticket": {
      "primary": "https://ticket.softbankhawks.co.jp/game/select"
    }
  },
  {
    "date": "2026-04-26",
    "match": {
      "home": "DeNA",
      "visitor": "巨人"
    },
    "info": {
      "stadium": "",
      "time": ""
    },
    "ticket": {
      "primary": "https://ticketsales.baystars.co.jp/calendar/2026/04",
      "resale": "https://ticket-resale.baystars.co.jp/purchase/match"
    }
  },
  {
    "date": "2026-04-26",
    "match": {
      "home": "中日",
      "visitor": "ヤクルト"
    },
    "info": {
      "stadium": "",
      "time": ""
    },
    "ticket": {
      "primary": "https://dragons-ticket.jp/Calendar.aspx",
      "resale": "https://tradead.tixplus.jp/dragons/buy/bidding?month=4&year=2026"
    }
  },
  {
    "date": "2026-04-26",
    "match": {
      "home": "阪神",
      "visitor": "広島"
    },
    "info": {
      "stadium": "",
      "time": ""
    },
    "ticket": {
      "primary": "https://hanshintigers.jp/ticket/detail/20260426.html"
    }
  },
  {
    "date": "2026-04-26",
    "match": {
      "home": "楽天",
      "visitor": "西武"
    },
    "info": {
      "stadium": "",
      "time": ""
    },
    "ticket": {
      "primary": "https://eagles.tstar.jp/seat260426",
      "resale": "https://nft.rakuten.co.jp/marketplace/?type=ticket&sort=last_updated_date&limit=12&ticketlimit=6&provider=eagles&date=26-04-2026"
    }
  },
  {
    "date": "2026-04-26",
    "match": {
      "home": "オリックス",
      "visitor": "日本ハム"
    },
    "info": {
      "stadium": "",
      "time": ""
    },
    "ticket": {
      "primary": "https://buffaloes.cnplayguide.com/ticket/20260426",
      "resale": "https://www.ticket.co.jp/sys/k/79911.htm?st=20260426"
    }
  },
  {
    "date": "2026-04-26",
    "match": {
      "home": "ソフトバンク",
      "visitor": "ロッテ"
    },
    "info": {
      "stadium": "",
      "time": ""
    },
    "ticket": {
      "primary": "https://ticket.softbankhawks.co.jp/game/select"
    }
  },
  {
    "date": "2026-04-28",
    "match": {
      "home": "巨人",
      "visitor": "広島"
    },
    "info": {
      "stadium": "",
      "time": ""
    },
    "ticket": {
      "primary": "https://www.giants.jp/schedule/first-team/?month=202604",
      "resale": "https://tradead.tixplus.jp/giants/buy/bidding?month=4&year=2026"
    }
  },
  {
    "date": "2026-04-28",
    "match": {
      "home": "ヤクルト",
      "visitor": "阪神"
    },
    "info": {
      "stadium": "",
      "time": ""
    },
    "ticket": {
      "primary": "https://ticket.yakult-swallows.co.jp/Calendar.aspx",
      "resale": "https://tradead.tixplus.jp/swallows/buy/bidding?month=4&year=2026"
    }
  },
  {
    "date": "2026-04-28",
    "match": {
      "home": "中日",
      "visitor": "DeNA"
    },
    "info": {
      "stadium": "",
      "time": ""
    },
    "ticket": {
      "primary": "https://dragons-ticket.jp/Calendar.aspx",
      "resale": "https://tradead.tixplus.jp/dragons/buy/bidding?month=4&year=2026"
    }
  },
  {
    "date": "2026-04-28",
    "match": {
      "home": "西武",
      "visitor": "日本ハム"
    },
    "info": {
      "stadium": "",
      "time": ""
    },
    "ticket": {
      "primary": "https://ticket.seibulions.jp/event/venue/26042801",
      "resale": [
        "https://ticket.seibulions.jp/resale/venue/26042801",
        "https://www.ticket.co.jp/sys/k/68848.htm?st=20260428"
      ]
    }
  },
  {
    "date": "2026-04-28",
    "match": {
      "home": "ロッテ",
      "visitor": "楽天"
    },
    "info": {
      "stadium": "",
      "time": ""
    },
    "ticket": {
      "primary": "https://m-ticket.marines.co.jp/ticket/20260428",
      "resale": "https://www.ticket.co.jp/sys/k/79881.htm?st=20260428"
    }
  },
  {
    "date": "2026-04-28",
    "match": {
      "home": "オリックス",
      "visitor": "ソフトバンク"
    },
    "info": {
      "stadium": "",
      "time": ""
    },
    "ticket": {
      "primary": "https://buffaloes.cnplayguide.com/ticket/20260428",
      "resale": "https://www.ticket.co.jp/sys/k/79911.htm?st=20260428"
    }
  },
  {
    "date": "2026-04-29",
    "match": {
      "home": "巨人",
      "visitor": "広島"
    },
    "info": {
      "stadium": "",
      "time": ""
    },
    "ticket": {
      "primary": "https://www.giants.jp/schedule/first-team/?month=202604",
      "resale": "https://tradead.tixplus.jp/giants/buy/bidding?month=4&year=2026"
    }
  },
  {
    "date": "2026-04-29",
    "match": {
      "home": "ヤクルト",
      "visitor": "阪神"
    },
    "info": {
      "stadium": "",
      "time": ""
    },
    "ticket": {
      "primary": "https://ticket.yakult-swallows.co.jp/Calendar.aspx",
      "resale": "https://tradead.tixplus.jp/swallows/buy/bidding?month=4&year=2026"
    }
  },
  {
    "date": "2026-04-29",
    "match": {
      "home": "中日",
      "visitor": "DeNA"
    },
    "info": {
      "stadium": "",
      "time": ""
    },
    "ticket": {
      "primary": "https://dragons-ticket.jp/Calendar.aspx",
      "resale": "https://tradead.tixplus.jp/dragons/buy/bidding?month=4&year=2026"
    }
  },
  {
    "date": "2026-04-29",
    "match": {
      "home": "西武",
      "visitor": "日本ハム"
    },
    "info": {
      "stadium": "",
      "time": ""
    },
    "ticket": {
      "primary": "https://ticket.seibulions.jp/event/venue/26042901",
      "resale": [
        "https://ticket.seibulions.jp/resale/venue/26042901",
        "https://www.ticket.co.jp/sys/k/68848.htm?st=20260429"
      ]
    }
  },
  {
    "date": "2026-04-29",
    "match": {
      "home": "ロッテ",
      "visitor": "楽天"
    },
    "info": {
      "stadium": "",
      "time": ""
    },
    "ticket": {
      "primary": "https://m-ticket.marines.co.jp/ticket/20260429",
      "resale": "https://www.ticket.co.jp/sys/k/79881.htm?st=20260429"
    }
  },
  {
    "date": "2026-04-29",
    "match": {
      "home": "オリックス",
      "visitor": "ソフトバンク"
    },
    "info": {
      "stadium": "",
      "time": ""
    },
    "ticket": {
      "primary": "https://buffaloes.cnplayguide.com/ticket/20260429",
      "resale": "https://www.ticket.co.jp/sys/k/79911.htm?st=20260429"
    }
  },
  {
    "date": "2026-04-30",
    "match": {
      "home": "巨人",
      "visitor": "広島"
    },
    "info": {
      "stadium": "",
      "time": ""
    },
    "ticket": {
      "primary": "https://www.giants.jp/schedule/first-team/?month=202604",
      "resale": "https://tradead.tixplus.jp/giants/buy/bidding?month=4&year=2026"
    }
  },
  {
    "date": "2026-04-30",
    "match": {
      "home": "ヤクルト",
      "visitor": "阪神"
    },
    "info": {
      "stadium": "",
      "time": ""
    },
    "ticket": {
      "primary": "https://ticket.yakult-swallows.co.jp/Calendar.aspx",
      "resale": "https://tradead.tixplus.jp/swallows/buy/bidding?month=4&year=2026"
    }
  },
  {
    "date": "2026-04-30",
    "match": {
      "home": "中日",
      "visitor": "DeNA"
    },
    "info": {
      "stadium": "",
      "time": ""
    },
    "ticket": {
      "primary": "https://dragons-ticket.jp/Calendar.aspx",
      "resale": "https://tradead.tixplus.jp/dragons/buy/bidding?month=4&year=2026"
    }
  },
  {
    "date": "2026-04-30",
    "match": {
      "home": "西武",
      "visitor": "日本ハム"
    },
    "info": {
      "stadium": "",
      "time": ""
    },
    "ticket": {
      "primary": "https://ticket.seibulions.jp/event/venue/26043001",
      "resale": [
        "https://ticket.seibulions.jp/resale/venue/26043001",
        "https://www.ticket.co.jp/sys/k/68848.htm?st=20260430"
      ]
    }
  }
]